product_name,ingredient,feature,skin_type,capacity,design,brand,expiry,origin,product_id,shop_id,type,skin_kind,is_5_star,num_sold_time,price
[Hàng mới về]<<BRING GREEN tea tree cica trouble cleansing foam 200ml>> Sữa rửa mặt Bring Green trà xanh cica tạo bọt,"phức hợp cây trà ba và cica, centela asiatica","làm dịu da, chăm sóc tế bào da chết và bã nhờn dư thừa, giảm mụn, loại bỏ chất thải và bã nhờn từ lỗ chân lông",,,"công thức dạng kem mềm mại, tạo bọt dày đặc, rửa sạch bằng nước",,,vận chuyển từ hàn quốc,14759148204,151104715,foam,Mọi loại da,1.0,3.231017770597738e-05,199000.0
Gel bí đao rửa mặt Cocoon (Winter melon cleanser) 140ml,"potasium laureth betaine, sodium cocoyl cocoyl methyl cocoate, cerifera bí đao fruit extract, acid, vitamin b3, vitamin b5, centela asiatica extract, rau má betaine, butylene glycol, peg 120 methyl glucose molasses, sodium lactate, sodium 20 tràm trà leaf oil, hương thảo leaf oil, oải hương flower oil, xanthan gum, menthyl lactate, sodium phytate, alcohol 0.01","làm sạch sâu lỗ chân lông, giảm lượng dầu thừa trên da, giảm mụn, kiểm soát lượng dầu thừa, làm giảm sự xuất hiện của lỗ chân lông to, độ ẩm mịn tự nhiên của da",,,,cocon,3 năm kể từ nsx,việt nam,3451121908,288562555,dạng sánh,"Da mụn trứng cá, Dầu, Nhạy cảm, Da mụn",0.9433962264150944,0.002514808831448573,220500.0
"Gel rửa mặt Simple, Toner nước hoa hồng cân bằng da Simple, Nước tẩy trang Simple cho da nhạy cảm",chiết xuất 10 từ thiên nhiên khoáng chất và dưỡng chất từ lá cây phỉ,"cân bằng độ ph cho da, dịu nhẹ an toàn, tăng cường độ ẩm và kiểm soát nhờn tốt",,150 ml,tuýp nhựa nắp bật,simple,,vương quốc anh,18016565113,726885991,no_type,Mọi loại da,0.8,0.0001723209477652127,59000.0
Sữa rửa mặt nhật perfect whip,"ami no axi t, tinh chất tơ tằm trắng, phức hợp 2 thành phần dưỡng ẩm 2 loại aci d","trắng da, ngăn chặn sắc tố melanin gây vết đốm tàn nhang, bổ sung độ ẩm, giữ độ ẩm, làm sáng da, tái tạo da, làm sạch bụi bẩn và bã nhờn sâu trong lỗ chân lông","phù hợp mọi loại da, đặc biệt phù hợp cho da dầu và da thường",,,,,,8074162673,264988200,no_type,Mọi loại da,0.94,0.0022240172320947766,29000.0
Sữa Rửa Mặt Laroche Posay,,làm sạch da tốt và ngăn ngừa tối đa hình thành mụn,dành riêng cho da dầu mụn nhạy cảm,,phiên bản bao bì mới nhất,la roche-posay efaclar,,,6180656023,96504273,no_type,no_skin,0.9770642201834863,0.002940226171243942,362500.0
"Sữa Rửa Mặt Hatomugi Ý Dĩ Ngừa Mụn, Làm Sáng DaThe Medicated Facial Foam 130g","water, myristic acid, peg-8 stearic acid, potassium lauric acid, coix ma-yuen sed extract, palmitic acid, glyceryl, glyceryl stearate se, glycol, cetyl alcohol, butylene glycol, aloe leaf extract, prunus leaf extract, alcohol, sodium cetyl pg camelia japonica sed oil, edta, citric acid, sodium","giúp loại bỏ bụi bẩn, dầu thừa ẩn sâu trong lỗ chân lông, giúp loại bỏ và ngăn ngừa mụn trứng cá, bổ sung độ ẩm, cải thiện tình trạng da khô thô ráp, làm sạch sâu da, mang lại làn da mịn màng tươi sáng hơn","phù hợp cho mọi loại da, đặc biệt là da mụn, da thiếu nước, da ẩm da xỉn màu thâm sạm",130g,"sữa rửa mặt dạng kem, tạo bọt mềm mịn",hatomugi,,nhật bản,10520214082,18644537,no_type,no_skin,0.9850187265917603,0.004178782983306408,66000.0
sữa rửa mặt SenKa Nhật,ứng dụng công nghệ tơ tằm trắng tiên tiến nhật bản,"làm sạch sâu, thư thái làn da",phù hợp với mọi làn da dù khô nứt nẻ hay chảo dầu,,,senka,,made in japan,3484444138,4508034,no_type,no_skin,0.9438202247191011,0.0015401184706515885,25000.0
Giá sỉ -Sữa rửa mặt Ponds sạch sâu 100g date 2025,,"giúp làm sạch bụi bẩn và chất ô nhiễm, mat xa nhẹ nhàng",,,,ponds,,"nhật bản, sản xuất và chịu trách nhiệm bởi cty tnh quốc tế unilever việt nam",19530458569,44108436,no_type,no_skin,1.0,0.0005869682283252558,25000.0
Ponds Sữa Rửa Mặt Chống Lão Hóa Age Miracle 100g suu.shop cam kết 100% chính hãng,pro-cel complex,"thúc đẩy quá trình tái tạo da, đẩy lùi quá trình lão hóa, làm sạch bụi bẩn bã nhờn, cân bằng độ ẩm, làm mềm da","phù hợp với nhiều loại da, đặc biệt là da cần chống lão hóa",10g,,pond's,có thông tin trên bao bì sản phẩm,"do unilever có nhiều nhà máy sản xuất ở đông nam á (thái lan, việt nam), nên xuất xứ và bao bì sản phẩm có thể thay đổi theo từng đợt nhập hàng",2282554801,149019141,no_type,no_skin,0.9565217391304348,0.0006085083467959074,79000.0
"Sửa rửa mặt tạo bọt làm sạch sâu, dịu nhẹ PEACHOLIC.","chiết xuất keo ong, chiết xuất lá ngải cứu, tp làm dịu da, bảo vệ da tránh kích ứng, cấp ẩm phục hồi da, chiết xuất cây bạch vị, aquaxyl, decyl, disodium","làm sạch, giảm sưng, bảo vệ da khỏi yếu tổ gây hại, tăng sinh khí, dịu da, làm mềm da, giảm kích ứng, tái tạo tế bào, cấp ẩm, tăng cường hàng rào bảo vệ da, ngăn chặn ẩm thoát ra ngoài, tạo bọt nhẹ nhàng, không gây khô da","da nào cũng có thể sử dụng được, kể cả da sau lăn kim, da yếu nhất nhạy cảm, da mỏng lộ gân máu cũng dùng được",,,glowing star,,,3792468247,265035422,dạng lỏng,Mọi loại da,1.0,0.0014808831448572966,349000.0
Sữa Rửa Mặt Nhau Thai Cừu Tế Bào Gốc Cuống Rốn Nhật Bản ❣️Chính Hãng❣️ Sữa Rửa Mặt Nhau Thai Cừu Tuyển Sỉ Toàn Quốc,"12 hoạt chất chiết xuất từ thực vật, vitamin và khoáng chất","dưỡng trắng, làm sáng, trẻ hóa, tăng độ đàn hồi, se khít lỗ chân lông, giảm mụn, mờ vết đồi mồi đốm sâu tàn nhang nám, làm dịu",,,,chantele sydney careline,,nhật bản,11272101756,185368094,dạng sánh,Mọi loại da,1.0,0.000210016155088853,69000.0
Sữa rửa mặt Tạo bọt Sạch nhờn cho da dầu UNO Whip Wash Black 130g,bọt đất sét khoáng kết hợp sức mạnh than hoạt tính,"làm sạch bã nhờn bụi bẩn sâu bên trong lỗ chân lông, hạn chế dầu nhờn, ngăn ngừa mụn, cung cấp độ ẩm cho da",da dầu da thường,130 g,,uno,3 năm kể từ ngày sản xuất,"sản phẩm xuất xứ từ nhật bản, nơi sản xuất việt nam",12894315997,795987077,no_type,no_skin,0.9324817518248175,0.008077544426494346,107000.0
[Hàng mới về] Gel tẩy tế bào chết làm sạch sâu dưỡng da ẩm mịn 70g,,"dưỡng ẩm làm mịn da mặt, tẩy tế bào chết, thu nhỏ lỗ chân lông, nuôi dưỡng, làm trắng dưỡng ẩm",,70 g,,,,,9361106051,424299840,no_type,no_skin,0.9420289855072463,0.0009208400646203554,26666.0
Sữa Rửa Mặt Medica Da Dầu Hỗn Hợp,"alantoin, chiết xuất từ hạt nhục đậu khấu và vitamin b5","làm dịu da, hạn chế khô da, giảm mụn, hiệu quả khá cả trong việc giảm tình trạng lão hóa da và vitamin b5 đem lại hiệu quả khá cao trong việc làm mềm da và tái tạo da hư tổn","da dầu, da thường",,,,,việt nam,4066263103,28989942,no_type,"Da mụn trứng cá, Da hỗn hợp, Dầu",0.9516129032258065,0.003031771674744211,169000.0
[Hàng mới về] Sữa rửa mặt thành phần Amino Acid kiềm dầu dưỡng ẩm,"axit amin, thành phần dưỡng ẩm","giúp loại bỏ dầu thừa, bụi bẩn, lớp trang điểm, làm sáng và khử độc",,60 g,"dạng kem và đệm, nhỏ và nhẹ",,,,11861656591,74782137,no_type,no_skin,0.8666666666666667,0.0001884760366182014,17050.0
"Sữa rửa mặt Innisfree tro núi lửa 150ml (Xả kho, Date T12/2023)",chiết xuất 10 từ thiên nhiên,"làm sạch sâu bụi bẩn bã nhờn, loại bỏ dầu thừa trên da, giúp da thông thoáng và cân bằng độ ẩm, ngăn ngừa mụn, thu nhỏ lỗ chân lông, thư giãn da",dành cho da dầu da mụn cám mụn đầu đen,10 ml,,inisfre,,,9840831813,415431195,no_type,"Mọi loại da, Dầu",1.0,8.077544426494346e-05,99000.0
Sữa Rửa Mặt Mướp Đắng ( Thảo Mộc Nhan ),"tinh chất mướp đắng, tinh chất bạc hà, tinh chất cây phỉ",thấm sâu vào bên trong da giúp da không bị khô sau khi rửa mà có cảm giác mềm mịn và sạch sâu vào bên trong da,da dầu da mụn,,đầu cọ silicol thông minh mềm mịn giúp máu lưu thông và thúc đẩy được quá trình hấp thu chất cho da tốt hơn,,,,16422998183,52098217,dạng kem,no_skin,1.0,0.0008939149165320409,120000.0
[Date 2023] Sữa rửa mặt dịu nhẹ Cetaphil 125ml - 500ml,,"không gây kích ứng da, loại bỏ chất nhờn trên mặt, giúp làn da trông tươi trẻ, tẩy sạch bụi bẩn và trang điểm mà không làm cho da bạn bị khô ráp, cung cấp độ ẩm thích hợp với da hỗn hợp và da dầu",phù hợp mọi loại da,"chai nhỏ mini 59 ml, chai vừa 125 ml, chai lớn 50 ml",,cetaphil,30 tháng kể từ ngày sản xuất in trên vỏ chai,canada nhập khẩu và chịu trách nhiệm bởi cty tnh dksh việt nam địa chỉ số 23 đại lộ độc lập khu cn việt nam phường bình hòa thành phố thuận an bình dương,5440837898,170184893,dạng lỏng,Nhạy cảm,0.9608938547486033,0.0052073236402800215,196280.0
SỮA RỬA MẶT CETAPHIL GENTLE SKIN CLEANSER,"nước tinh khiết, cetyl alcohol, glycol, sodium lauryl sulfate, stearyl alcohol","làm sạch da, trị mụn, làm mềm và dịu da",người có da mụn,có 2 dung tích phân loại là 125 ml và 50 ml,công thức đặc biệt ít tạo bọt,cetaphil,,canada,4750147783,1954539,no_type,no_skin,0.9456521739130435,0.0014270328486806678,207000.0
SỮA RỬA MẶT ADERMA CHO CÁC LOẠI DA SIÊU THÍCH CÁC SIZE,chiết xuất yến mạch,"nhẹ dịu, làm sạch sâu, không làm khô da",nhạy cảm,"50 ml, 10 ml, 20 ml (mini try), 40 ml, ful size",nắp chai hoặc tuýp nắp bật hoặc vòi,a derma,"12 m sau mở nắp (20 ml ful size), 6 m sau mở nắp (40 ml ful size, mini try)",pháp,4834678090,84827585,dạng lỏng,"Da mụn trứng cá, Mọi loại da, Da hỗn hợp, Khô, Nhạy cảm",0.989010989010989,0.004130317716747442,230000.0
SỮA RỬA MẶT DONA  ngọc trai,,sáng da,,,,dona,,,11817239322,304607867,dạng kem,Mọi loại da,0.9354838709677419,0.0009639203015616586,21000.0
 Sữa rửa mặt DABO Hàn Quốc 3 trong 1 SRD43,"tinh chất trà xanh, tinh chất lô hội, tinh chất than hoạt tính","làm trắng sáng làn da, tẩy nhẹ lớp tế bào chết, làm sạch sâu lỗ chân lông, tẩy trang nhẹ, kháng khuẩn, trị mụn, se khít lỗ chân lông, khử độc, sáng da, tái tạo da, loại bỏ yếu tố gây viêm nhiễm dẫn đến mụn, thông thoáng lỗ chân lông, cung cấp các vi chất cần thiết cho da",,60 ml,"chai nhỏ, tiện lợi",dabo,,hàn quốc,2143729952,10208046,no_type,no_skin,0.9404388714733543,0.0210016155088853,38000.0
Sữa Rửa Mặt Tẩy Tế Bào Chết Utena Everish Nhật Bản 135g,thành phần thiên nhiên,"loại bỏ bụi bẩn tế bào chết và mụn đầu đen sâu bên trong lỗ chân lông, mang đến cảm giác tươi mát và sảng khoái không hề bị căng cứng hay khô da sau khi dùng",thích hợp với mọi loại da,,,utena everish,,,4320554940,213154129,no_type,no_skin,0.9622641509433962,0.002563274098007539,96000.0
[BẢN ĐÀI] Sữa Rửa Mặt Dạng Bùn Naruko Trà Tràm Tea Tree Purifying Clay Mask and Cleanser in 1 120gr,"bùn trà tràm, dầu trên da, chiết xuất từng loại thảo dược khác nhau","sữa rửa mặt, đặc trị mụn, sâu cân bằng dầu trên da, tăng độ săn chắc cho da",phù hợp với tất cả các loại da,120 gr,,naruko,3 năm kể từ ngày sản xuất,đài loan,17867520084,34983004,dạng kem,Mọi loại da,1.0,0.0013301023155627356,159000.0
"Sữa Rửa Mặt Lavie Làm Sạch Mặt, Căng Bóng Da Loại Bỏ Bã Nhờn Sử Dụng Mọi Loại Da 150ml [Tặng Kem Body]","aqua, sodium laureth sulface, betaine, sodium cocamide dea, dmdm, potasium, lactose, sucrose","làm sạch sâu, kiểm soát dầu nhờn, giúp cân bằng độ ẩm và nồng độ ph cần thiết cho da, giúp da trắng sáng, căng bóng và khỏe khoắn hơn mỗi ngày",,150 ml,"lọ dung tích 150ml, màu sắc trang nhã",lavie,3 năm kể từ ngày sản xuất,,9001071500,83036086,no_type,no_skin,0.8,4.3080236941303174e-05,156000.0
Sữa Rửa Mặt Nhau Thai Cuốn Rốn Cừu Nhật Bản Fengbiyi 130ml,"chiết xuất từ nhau thai cừu, 12 hoạt chất chiết xuất từ thực vật, vitamin và khoáng chất","giúp da sạch sâu từ bên trong, đều tiết tuyến chất nhờn trên da, ngăn ngừa các vi khuẩn có hại xâm nhập vào da, làm dịu các vết thương do mụn để lại, giảm thâm nám, cân bằng ph cho da, dưỡng trắng và làm sáng da, giúp da luôn hồng hào căng mịn, cải thiện tình trạng thô ráp da, giữ ẩm cải thiện các vấn đề da từ sâu bên trong, chống oxy hóa mạnh, tăng cường bảo vệ các tế bào da, giúp da luôn mịn màng khỏe mạnh",,,,chantele sydney careline,,,5781637325,187918840,no_type,no_skin,1.0,0.00024771136241249326,95000.0
GEL RỬA MẶT KHỔ QUA SOHERBS 80ML,chiết xuất khổ qua và các tinh chất tự nhiên khác,cân bằng làm sạch nhẹ nhàng và đặc biệt phù hợp cho các làn da nhạy cảm đang gặp vấn đề về mụn,,,,,,,5007210502,63494208,no_type,no_skin,0.9090909090909091,0.0009316101238556812,70000.0
SỮA RỬA MẶT POND’S 100ML – THÁI LAN,"glycerin, b3, lycopene","làm sạch lỗ chân lông, loại bỏ bã nhờn và tế bào chết",,,,pond's,,,5451468125,96135171,no_type,no_skin,0.958041958041958,0.002250942380183091,80000.0
Sữa rửa mặt làm sạch mụn Murad Acne Control Clarifying Cleanser,,làm sạch mụn,,tuýp tách set 60 ml 130 ml 20 ml,,murad,,mỹ,7169455675,134238200,no_type,"Da mụn trứng cá, Da hỗn hợp, Dầu",1.0,0.0001777059773828756,520000.0
SỮA RỬA MẶT / Sữa rửa mặt Sum:37 mini 40ml,chiết xuất thảo dược atiso,"giúp làm sạch sâu, tẩy trang, loại bỏ sừng già siêu nhỏ, duy trì độ ẩm cho da",,40 ml,"dạng kem dẻo, bọt dày siêu mịn, tạo lớp đệm giữa bàn tay và da mặt",su m37,,,4502437417,172499869,dạng sánh,Mọi loại da,0.9686274509803922,0.008077544426494346,47900.0
[Hàng mới về] Sữa rửa mặt tạo bọt INNISFREE,"việt quất, trà xanh, bija, hạt táo, ô liu, hoa anh đào","làm sáng, chống oxy hóa, phục hồi sức khỏe và sự tươi trẻ cho da",,"10 ml, 20 ml",sữa rửa mặt tạo bọt nhiều với độ ph 5.5,,,,16041386052,388141950,no_type,no_skin,1.0,8.077544426494346e-05,165357.0
SỮA RỬA MẶT TRÀ XANH GREEN TEA 3W CLINIC HÀN QUỐC 100ML,trà xanh,"giúp phục hồi da, loại bỏ các độc tố, ngăn ngừa lão hóa",,,,,,,597059716,29559718,no_type,no_skin,0.9639278557114228,0.009154550350026925,35000.0
"Sữa rửa mặt sạch sâu, ngừa mụn từ than hoạt tính 3W CLINIC CHARCOAL CLEANSING FOAM Hàn Quốc 100ml",chiết xuất thiên nhiên,"làm sạch, trắng da, khử khuẩn, khử mùi, chống lại tia tử ngoại khi đi nắng, ngăn chặn sự hình thành mụn cám và mụn đầu đen, làm mịn da và săn chắc da","tất cả các loại da, đặc biệt hiệu quả với da dầu, da mụn và da hỗn hợp",10ml,"chai nhỏ, dễ dàng mang theo khi đi du lịch hoặc đi làm",3w clinic,,hàn quốc,9954651704,323611095,dạng kem,"Lão hóa, Mọi loại da, Da hỗn hợp, Khô, Bình thường",0.9245283018867925,0.001464728056004308,50000.0
Kem rửa mặt giảm nhờn hiệu quả OXY Deep Wash (Scrub) 100g,"than đen, than tre, vitamin b3 và chiết xuất tảo biển","làm sạch sâu đánh bay nhờn, ráo bụi bẩn, và kiểm soát nhờn kéo dài",dành cho da dầu thô ráp sần sùi,10 g,bao bì có thay đổi tùy đợt nhập hàng,oxy,3 năm kể từ ngày sản xuất,"thương hiệu nhật bản, nơi sản xuất việt nam",17486163584,815777713,no_type,no_skin,1.0,0.00015616585891222403,58000.0
Sửa rửa mặt ý dĩ Hatomugi Naturie Nhật Bản,"hạt ý dĩ, lúa mạch, đào, vitamin","giảm chất bã nhờn, làm sạch da, giảm sưng, làm trắng da, mờ vết thâm, làm mát da, phục hồi làn da bị tổn thương, dưỡng ẩm cho da, chống lão hóa da, ngăn ngừa vết nhăn, giảm chảy xệ, se khít lỗ chân lông, hạn chế bã nhờn, làm trắng sáng da mờ thâm",2 loại: da dầu nhờn mụn và da thường khô,tuýp 130 g hoặc 170 g,tuýp,hatomugi,,made in japan,9431470468,225902602,no_type,no_skin,0.9545454545454546,0.0010823909531502422,49000.0
Sữa rửa mặt dưỡng ẩm Forever Young 300ml,,loại bỏ ô nhiễm bụi bẩn dầu thừa và lớp trang điểm mà không gây khô căng k ích ứ ng da cấp ẩm cho da và làm mềm mướt bề mặt da loại bỏ tế bào da chết giúp da mịn màng tươi sáng làm căng mướt bề mặt da giàu chất chống oxy hóa,dùng được cho mọi loại da,,,,,,14434112863,20588208,dạng lỏng,Mọi loại da,1.0,0.000210016155088853,525000.0
"Sữa Rửa Mặt Dermacos Anti-Acne Deep Cleansing Gel Cho Da Dầu, Da Mụn 150ml","amino acid tự nhiên, nguồn gốc táo dừa, chiết xuất thảo dược liễu trắng salix alba, bơ lô hội (aloe leaf extract), bơ dầu jojoba buter and oil, nguyên tố vi lượng mg, kẽm, đồng, sắt, silicon ferment, bùn vàng đen peat extract","làm sạch sâu, giảm mụn, se khít lỗ chân lông, kháng khuẩn, làm giảm tình trạng mụn sưng tấy, giảm sự hoạt động của mụn, ngăn ngừa tái phát mụn, giúp loại bỏ mọi bụi bẩn lượng dầu dư thừa trên da cho da trở nên mịn màng sáng khỏe và ngừa thâm mụn hiệu quả.",cho làn da dầu mụn và dễ nổi mụn.,150 ml,chai nhựa có kèm nắp đậy và ống bơm.,dermacos dep gel,,ba lan,13642073589,374779912,dạng kem,"Da mụn trứng cá, Khô, Bình thường, Dầu",0.9438202247191011,0.001464728056004308,195000.0
Gel Lau/Rửa Da Sinh Lý Ziaja Med Lipid Dermatological Formula Physioderm Cleansing Face Gel 200ml,"natri cocoyl, b5","làm sạch da nhẹ nhàng và hiệu quả, không gây kích ứng da và không làm khô da, làm dịu nhẹ da, dưỡng ẩm dưỡng da mịn màng","da khô, viêm da, cơ địa da nhạy cảm, các bệnh lý về da, trẻ sơ sinh và trẻ nhỏ",,,xuất xứ thương hiệu ba lan,xem trên bao bì sản phẩm,nan,10000494846,342189282,no_type,no_skin,0.9743589743589743,0.0017878298330640818,275000.0
Xà bông rửa mặt ngăn mụn trắng da clobetamil g,triết xuất từ tinh dầu cam,"an toàn cho người sử dụng, vị cam thơm nức mũi, rửa sạch dầu thừa bụi bẩn chất nhờn, đánh bay mụn đầu đen và mụn cám, đem lại làn da trắng sạch",,,,galong,,thái lan,2329530163,126342909,no_type,no_skin,0.9134615384615384,0.0052934841141626275,9000.0
SỬA RỬA MẶT NHUỴ HOA NGHỆ TÂY MẬT ONG,chính safron mật ong và nghệ tươi,"sạch lỗ chân lông, hỗ trợ cải thiện da mụn, làm lành tổn thương do mụn, mờ vết thâm và sáng da mềm mịn da kháng khuẩn",mọi loại da đặc biệt da mụn và nhạy cảm,10 ml,,,,uk,19945040189,27191187,no_type,Mọi loại da,1.0,0.0001777059773828756,22000.0
Gel rửa mặt cho da dầu mụn A-DERMA PHYS-AC FOAMING GEL PURIFYING 25ml/ 100ml [NHẬP KHẨU CHÍNH HÃNG 100%],"water/aqua, sodium, sodium cocoyl, peg-120 methyl glucose, sodium avena sativa (oat) extract, avena sativa, caprylyl glycol, glycol, citric acid, glutamic acid, glyceryl oleate, acid gren 5, ci 61570, palm citrate, peg-40 castor oil, glycol, sodium","làm sạch tối ưu, giảm mụn và giảm kích ứng da","phù hợp cho mọi loại da, đặc biệt là da dầu mụn","dạng chai 25 ml, 10 ml","sản phẩm được thiết kế dạng gel siêu nhẹ dịu, dễ dàng tạo bọt và rửa sạch nhanh chóng, không làm bít tắc lỗ chân lông",a-derma,3 năm kể từ ngày sản xuất,pháp,11838779395,31897126,dạng gel,"Da mụn trứng cá, Mọi loại da, Bình thường, Dầu, Nhạy cảm",0.970873786407767,0.0017932148626817448,199000.0
Gel rửa mặt/ kem dưỡng ngừa mụn Dermacos Antiacne Farmona,,"làm sạch da, ngừa mụn, giảm bụi bẩn và dầu dư thừa trên da, thông thoáng lỗ chân lông",,hộp 150ml,,dermacos,,thương hiệu ba lan,10876831346,284810355,no_type,no_skin,0.9803921568627451,0.001362412493268713,220000.0
Sữa Rửa Mặt trà xanh Innisfree 𝑪Ó 𝑩𝑰𝑳𝑳 sữa rửa mặt innisfree Green Tea Cleansing Foam 150ml Hàn Quốc,"chiết xuất từ 10 trà xanh nguyên chất, linoleic acid, vitamin e và các chất khoáng","làm sạch nhẹ dịu, loại bỏ bã nhờn thừa và các chất thải trên bề mặt da, tái tạo tế bào da, kiềm dầu hạn chế mụn, chống tia cực tím và oxi hóa da, ngăn ngừa lão hóa da", không có thông tin,150 ml,,inisfre,3 năm kể từ ngày sản xuất,hàn quốc,19606795856,515537428,no_type,Mọi loại da,1.0,0.000570813139472267,160000.0
[Giá siêu tốt - Full 240ml] Sữa rửa mặt PURITY,"sodium, sed oil, sodium sulfate, oil blend","làm sạch sâu bên trong lỗ chân lông và loại bỏ lớp trang điểm, cân bằng độ ẩm cho da",phù hợp với mọi loại da,,,purity,,mỹ,122126072,528912,no_type,no_skin,0.975,0.001362412493268713,686500.0
Sửa Rửa Mặt Rau Củ sủi bọt thải độc 3 in 1 Byvibes Wonder Bath Super Vegitoks Cleanser 300ML,"10 thành phần rau củ như bắp cải, su hào, cần tây, chanh, súp lơ lá, rau diếp cá, cà chua, khoai tây, lá bạc hà, mầm lúa mì","tẩy trang, rửa sạch sâu, mặt nạ thải độc, giúp làm sạch da, giúp da sạch mụn mịn màng trắng sáng giảm thâm nám da kích thích sản sinh colagen và làm mềm da dưỡng da cân bằng độ ẩm cho da",,30 ml,"chai màu xanh, tím, đỏ có hạt bọt nhỏ",byvibes wonder bath,3 năm kể từ nsx,hàn quốc,9526749509,350249901,dạng sánh,Mọi loại da,0.9702970297029703,0.0011470113085621971,189000.0
[MUA 1 TẶNG 2 MASK] Sữa rửa mặt giảm mụn Caryophy Portulaca Cleansing Foam 150ml,"rau má, thanh nhiệt, gia m ti nh, tràng tiền, giấp, saponin, axit asiatic, axit brahmic","giảm mụn, làm sạch, ngăn ngừa bị bít kín lỗ chân lông, giữ ẩm, làm đều màu da, giảm nếp nhăn, tăng độ đàn hồi, phục hồi các thương tổn, làm dịu da kích ứng, hạn chế vết thâm do mụn",phù hợp cho mọi loại da,150 ml,bao bì thân thiện với môi trường,caryophy,3 năm kể từ ngày sản xuất,hàn quốc,5200899823,167114296,dạng kem,Mọi loại da,0.9823008849557522,0.0059235325794291865,259000.0
[Bill Mỹ] Sữa Rửa Mặt Hoa Cúc Calendula Deep Cleansing Foaming Face Wash Kiehl’s 500ml,"hoa cúc, công thức dạng gel",làm sạch và mang đến vẻ ngoài tươi mới cho làn da,da dầu và da thường,,,,,,1692699564,35826509,no_type,no_skin,1.0,0.00028002154011847065,1150000.0
[innisfree] Sữa rửa mặt Volcanic Pore BHA 150g,công thức chứa thành phần bha,"làm sạch sâu tận lỗ chân lông của làn da dầu đầy lỗ chân lông và những lo ngại về bã nhờn, tẩy tế bào chết được nâng cấp với chức năng làm dịu da bị mụn",dành cho làn da dầu đầy lỗ chân lông,150 g,,,,,12720125019,546036505,no_type,no_skin,0.8846153846153846,0.00041464728056004306,125000.0
Nature Republic Sữa rửa mặt dưỡng sáng da Vitapair C Foam Cleanser 150ml,"chiết xuất chanh jeju 30 pm, vitamin c ascobic acid 10 pm, ascobyl 10 pm, rau má, citric acid","loại bỏ bụi bẩn tạp chất trên da, dưỡng sáng và làm đồng đều màu da, làm dịu da",mọi loại da da tối xỉn màu thâm mụn tàn nhang,150 ml,,nature republic,3 năm kể từ ngày sản xuất,hàn quốc,12622630112,549295567,no_type,"Mọi loại da, Da tối, xỉn màu",1.0,0.001777059773828756,148500.0
"Sữa rửa mặt Puderma Advanced Refreshing Cleansing Foam dưỡng ẩm, làm sạch da 120m",,"làm sạch da, dưỡng ẩm, mang lại làn da sáng mịn màng",,120 ml,,puderma,,hàn quốc,11072679650,498090130,dạng lỏng,Mọi loại da,1.0,6.462035541195476e-05,350000.0
