product_name,ingredient,feature,skin_type,capacity,design,brand,expiry,origin,product_id,shop_id,type,skin_kind,is_5_star,num_sold_time,price
Sữa rửa mặt Simple lành tính sạch thoáng - cho da nhạy cảm 150ml [CHÍNH HÃNG ĐỘC QUYỀN] [DIỆN MẠO MỚI],x2 vitamin b5 vitamin e và pro amino acids,lành tính sạch thoáng cho da nhạy cảm,,,,simple,03 năm,poland,8587034871,111138057,no_type,no_skin,0.9081388390185517,1.0,99000.0
Sữa rửa mặt Simple giúp kiềm dầu và ngừa mụn hiệu quả - cho da dầu mụn 150ml [CHÍNH HÃNG ĐỘC QUYỀN] [DIỆN MẠO MỚI],"chiết xuất cây hazel, kẽm, vitamin b3","kiềm dầu, ngừa mụn, cân bằng độ ẩm",da dầu dễ nổi mụn,,,simple,03 năm kể từ ngày sản xuất,poland,8287055694,111138057,no_type,no_skin,0.9082950317356095,0.5525040387722132,99000.0
"Sữa rửa mặt nam 30Shine phân phối chính hãng Skin&dr Tràm trà 80g cho da mụn, da dầu, dưỡng ẩm trắng da",chiết xuất từ cây tràm trà chứa axit và glycolic có trong cây đu đủ chứa axit aha bh,"làm sạch da hiệu quả, làm mờ vết thâm, giúp da sáng đều màu và khỏe mạnh rạng rỡ, làm sạch sâu, giúp lỗ chân lông thông thoáng, cân bằng ph cho da, hỗ trợ tái tạo làn da mới mịn màng tươi sáng, điều tiết dầu nhờn, giúp da thoáng sạch se khít lỗ chân lông, cấp ẩm duy trì sự mềm mại cho da, ngăn chặn khô bong tróc, có khả năng làm sạch lớp trang điểm trên da.","cho da mụn, da dầu",80g,tuýp nhựa mềm có nắp đậy,skin dr tràm trà,2 năm kể từ ngày sản xuất,hàn quốc,9335942418,21080428,dạng kem,no_skin,0.9455370650529501,0.04361873990306947,244000.0
Sữa rửa mặt nam RHYS MAN Rhys Coconut Fresh hương dừa thơm mát 100ml,"chiết xuất lô hội, tinh chất dầu dừa, tinh dầu bạc hà","giúp làm sạch da, giảm nhờn và giữ ẩm, giảm mụn, se nhỏ lỗ chân lông, dưỡng ẩm và làm sáng da, loại sạch bụi bẩn và bã nhờn",,10 ml,,rhys man,2 năm kể từ ngày sản xuất,việt nam,19601743242,758111427,dạng sánh,Da hỗn hợp,0.9333333333333333,0.01938610662358643,119000.0
🌈🍒🍭 Sữa Rửa Mặt Senana Lấy Sạch Bụi Bẩn Giúp Da Trắng Sáng-Y3-K6T3,,"dưỡng da ẩm mượt tươi trẻ, cấp nước",,60 g,tuýp nhỏ gọn,senana,,nội địa đài loan,3330988133,107632788,no_type,no_skin,0.903041825095057,0.1416262789445342,9900.0
Sữa Rửa Mặt Simple Refreshing Facial Wash 150ml kiềm dầu Giảm Mụn,,kiềm dầu giảm mụn,thích hợp cho mọi loại da,150 ml,sữa rửa mặt dạng gel,simple,,,14548366720,594960937,dạng gel,no_skin,0.5,0.0001884760366182014,31000.0
Sữa Rửa Mặt Dạng Gel Simple Refreshing  – LQ154,,"khả năng làm sạch nhẹ nhàng, ngăn chặn tối đa sự hình thành của mụn trên da",,150 ml,dạng gel siêu mềm mịn với độ ph cân bằng,simple facial,,,3313234281,102812033,no_type,no_skin,0.9230769230769231,0.0003931071620893915,35000.0
"Sữa Rửa Mặt Simple Kind To Skin Refreshing Facial Wash, Kiềm Dầu, sạch Mụn 150ml","nước aqua, hoạt chất b5, hoạt chất thanh lọc bụi bẩn và làm dịu da","làm sạch da, lấy đi bụi bẩn và bã nhờn dư thừa, giảm nguy cơ hình thành mụn trứng cá và mụn đầu đen, mang lại làn da với lỗ chân lông thông thoáng","phù hợp với da thường, da hỗn hợp, da dầu, da mụn và đặc biệt là da nhạy cảm",150g,"chất gel trong suốt, hộp nhựa màu trắng đơn giản",simple,,,14885253904,492729537,dạng lỏng,Mọi loại da,1.0,0.00014001077005923533,33500.0
Sữa rửa mặt giảm nám và chống tàn nhang Đông Y Baizton da trắng sáng và dưỡng ẩm 60g,,giúp làm mờ các mảng nám tàn nhàng và thâm mụn hiệu quả hiệu quả đối với tất cả các loại nám từ nám mảng chân sâu và nám hỗn hợp nám mới hay lâu năm đều có hiệu quả khi sử dụng đủ liệu trình sản phẩm dưỡng da trắng sáng tự nhiên và đều màu cân bằng dầu nhờn diệt mụn liti mụn cám trên da se khít lỗ chân lông dưỡng ẩm dưỡng mịn và giảm nhăn vết chân chim trên da,,,,,,,21347751073,102812033,no_type,no_skin,1.0,4.3080236941303174e-05,19900.0
Sữa Rửa Mặt SVR Sebiaclear Gel Moussant 400ml Gel Rửa Mặt SVR 400ml,,"làm sạch nhẹ nhàng, thông thoáng làn da, tạo bọt mịn, loại trừ chất bẩn và lượng bã nhờn dư thừa, sản phẩm phù hợp với da hỗn hợp đến da dầu, da mụn nhạy cảm, giảm viêm và tiêu sửng, giúp điều hòa lượng bã nhờn dư thừa cho làn da không bóng dầu, không chứa xà phòng, không chứa cồn, không chứa chất tạo màu, không chứa paraben, không gây dị ứng","da hỗn hợp đến da dầu, da mụn nhạy cảm",40ml,"dạng gel không chứa xà phòng, tạo bọt mịn, dễ dàng rửa sạch mà không nhờn rít da. đóng gói nhỏ gọn tiện dụng.",svr,,"thương hiệu pháp, sản xuất tại pháp",19931947987,425554589,no_type,"Da mụn trứng cá, Mọi loại da, Da hỗn hợp",0.9926900584795322,0.011308562197092083,329000.0
[Chính Hãng] Sữa Rửa Mặt Simple Gel Kind To Skin Refreshing Facial Wash Gel 150ml,"nước tinh lọc 3 lần, vitamin, pro vitamin b5, vitamin e","làm sạch da, giữ ẩm, phục hồi, chống lão hóa","mọi loại da, đặc biệt là da nhạy cảm",,dạng gel,simple,,anh quốc,11341289197,425719485,no_type,no_skin,0.8333333333333334,0.01615508885298869,40000.0
Sữa Rửa Mặt Làm Sạch Bio Sebium Moussant 200ml,làm sạch nhẹ nhàng hạn chế tiết bã nhờn ngăn ngừa bít lỗ chân lông an toàn cho da mặt và mắt hương thơm nhẹ không gây mụn không làm khô da không chứa xà phòng,,,,,,,,15242612310,10154407,no_type,no_skin,0.9770992366412213,0.002207862143241788,160000.0
Sữa Rửa Mặt Simple Kind To Skin 150ml,,"làm sạch da, giảm nguy cơ mụn đầu đen và trứng cá, giữ ẩm cho da","thích hợp cho da thường, da hỗn hợp, da dầu, da mụn và da nhạy cảm",150 ml,chai nhựa,simple,,,18739266619,492888606,no_type,no_skin,0.5,2.1540118470651587e-05,32000.0
"Gel Rửa Mặt Cosrx Tràm Trà, 0.5% BHA Độ pH Thấp Low pH Good Morning Gel Cleanser 150ml - Hasaki - Sản phẩm chính hãng","chiết xuất tràm trà, 0.5 bha tự nhiên, alantoin","làm sạch sâu lỗ chân lông, hỗ trợ kháng khuẩn, tẩy tế bào chết nhẹ nhàng, làm dịu da, giữ độ ẩm cân bằng tự nhiên cho da","phù hợp với mọi loại da, đặc biệt da nhạy cảm, da khô và da mụn",150 ml,dạng gel trong suốt và có khả năng tạo bọt nhẹ nhàng,cosrx,3 năm kể từ ngày sản xuất,hàn quốc,11920972786,18644537,no_type,no_skin,0.9739239710964499,0.05331179321486268,130000.0
Sữa rửa mặt trà xanh mẫu mới,8 chiết xuất lá trà xanh tự nhiên nguyên chất giàu độ ẩm và các thành phần chống oxy hóa,"giúp làm sạch và loại bỏ cặn bẩn, làm mềm mại và căng mịn da, giúp ngăn ngừa và điều trị mụn hiệu quả",hầu hết các loại da kể cả da nhạy cảm,,,seedling,,,5751760776,22030358,no_type,Mọi loại da,0.8483483483483484,0.01992460958535272,19000.0
Sữa rửa mặt Samsara 100ml,công thức độc đáo,"loại bỏ các chất bụi bẩn từ tận sâu lỗ chân lông, ngăn ngừa tiềm ẩn sự hình thành mụn mới, giúp se lỗ chân lông, cải thiện da mịn màng sau khi hết mụn, giảm thiểu tác hại của ánh mặt trời với da, trắng hồng láng mịn",,,,samsara,,,6706769027,191939293,dạng sánh,Mọi loại da,0.9722222222222222,0.0011631663974151858,72000.0
Sữa rửa mặt Dr.Pepti GALACTO CLEANSING FOAM,chiết xuất từ thành phần thảo dược tự nhiên,làm sạch sâu da dịu nhẹ cho lỗ chân lông thông thoáng ngăn ngừa mụn điểm nổi bất nhất chính là giữ cho da có độ ẩm tự nhiên và dưỡng da trắn g sáng,phù hợp với mọi loại da đặc biệt phù hợp với da dầu và da nhờn kể cả làn da nhạy cảm và dễ kích ứng với mỹ phẩm,,,,,,3081638442,224928155,no_type,Mọi loại da,0.9583333333333334,0.0006569736133548734,115000.0
sữa rửa mặt Sữa Rửa Mặt Dưỡng Ẩm Làm Trắng Da Axit Amin Axit Salicylic Kiểm Soát Dầu 500g Làm sạch sâu thu nhỏ lỗ chân l,cốt acid glycine dừa amide,"làm sạch sâu, cân bằng dầu mỡ, giữ ẩm và đàn hồi",,50 g,"thân mật, khóa xoay, đầu bơm thân mật",sparkles,,,15995812483,892935381,dạng kem,Mọi loại da,1.0,3.231017770597738e-05,223500.0
Sữa Rửa Mặt Heyxi Chiết Xuất Lô Hội Làm Sạch Sâu Kiềm Dầu Dưỡng Ẩm Cho Nam Và Nữ HSRM2,lô hội,"làm sạch sâu, kiểm soát dầu, dưỡng ẩm","mọi loại da (nhờn, khô, nhạy cảm, hỗn hợp)",10g/ml,sữa rửa mặt gel,nội địa chất lượng cao,3 năm,,12339980805,415318899,dạng kem,no_skin,0.8461538461538461,0.010770059235325794,13000.0
Sữa Rửa Mặt SVR Sebiaclear Gel Moussant Cho Da Dầu Mụn & Loại Bỏ Tế Bào Chết 55ml 200ml 400ml Chính Hãng,,loại bỏ tế bào chết,cho da dầu mụn,20 ml 40 ml,dạng sản phẩm gel,svr,,pháp,17985827493,849418876,dạng sánh,"Mọi loại da, Da hỗn hợp, Khô, Bình thường, Nhạy cảm",1.0,0.01992460958535272,322000.0
Sữa Rửa Mặt NICOR Amino Acid Dưỡng Ẩm 120ml Cho Nam Nữ,bạch tuyết axit amin glycerin,"làm mềm và nuôi dưỡng da, bổ sung độ ẩm và dưỡng chất cho da, làm sạch da của dầu thừa, giúp da ngậm nước và mịn màng",nhiều loại da khác nhau,120 g,,nicor,,,13995110712,779446567,dạng lỏng,no_skin,0.8221709006928406,0.009154550350026925,24600.0
Sữa rửa mặt nghệ và mật ong collagen x3 [Chính Hãng],"nghệ, mật ong","trắng da, ngừa mụn, diệt khuẩn, lấy đi tế bào chết, làm mờ các vết thâm trên da, giúp da tươi trẻ và sáng mịn",,,,honeybee,,,6981203143,164377582,dạng lỏng,Mọi loại da,0.9466019417475728,0.006462035541195477,45500.0
(chính hãng) Sữa rửa mặt Hatomugi Naturie hạt ý dĩ 130g 170g Nhật Bản,,,,,,,,,9644340745,391102704,no_type,no_skin,0.9603340292275574,0.10123855681206247,47500.0
Sữa rửa mặt Hatomugi ý dĩ dưỡng ẩm trắng da Reihaku Cleansing Facial Foam Nhật Bản,"hạt coix, yến mạch, vitamin e, axit amin","trắng sáng da, dưỡng ẩm, chống viêm và chống lão hóa da",thích hợp cho mọi loại da,"trắng 130g, lớn 170g",chai,hatomugi,,marie japan,10147715751,83432445,dạng kem,Mọi loại da,0.9809932556713673,0.025309639203015617,59500.0
[MUA 1 TẶNG 1] Sữa rửa mặt dành cho da mụn Senka perfect whip acne care 100g,"ngăn ngừa mụn chiết xuất từ hoa cúc từ vùng kyoto nhật bản, acid thuộc nhóm bha","loại bỏ tế bào chết, ngăn chặn tình trạng mụn, làm sạch bụi bẩn và giảm nhờn bóng dầu, cung cấp độ ẩm, chống oxi hóa, giúp da sạch thoáng ẩm mịn sáng rạng rỡ",,,,shiseido,3 năm kể từ ngày sản xuất,công ty tnh shiseido việt nam,8789020831,27495213,no_type,no_skin,0.9582215408202377,0.0366182014001077,147000.0
【💯hàng thật】Sữa Rửa Mặt cetaphil Gentle Skin Cleanser 500ml,,"loại bỏ chất nhờn trên mặt, tẩy sạch bụi bẩn và trang điểm mà không làm cho da bị khô ráp, cảm giác sảng khoái tươi mát và sạch sẽ, không gây kích ứng cho da, giúp da giữ được độ ẩm cần thiết để lại cảm giác làn da mềm mại mịn màng và khỏe mạnh",,50 ml,,cetaphil,,nước,19967193547,847763581,no_type,no_skin,0.9272727272727272,0.0059235325794291865,240000.0
Sữa Rửa Mặt SENANA Amino Acid Collagen 60g Làm Sạch Sâu Dưỡng Ẩm Kiểm Soát Dầu,"axit amin, collagen","làm trắng, hiệu quả dưỡng ẩm, làm sạch sâu",áp dụng chung,60g,,,,,18424418643,8217147,no_type,no_skin,0.9230769230769231,0.0013247172859450727,15000.0
Gel rửa mặt Cosrx Low pH Good Morning Gel Cleanser,"tinh dầu tràm trà, tea tre oil, bha tự nhiên","kiểm soát dầu trên da, thu nhỏ lỗ chân lông, điều chỉnh kết cấu da, dịu nhẹ","phù hợp với mọi loại da, ngay cả da nhạy cảm và da đang gặp nhiều vấn đề",150 ml,dạng gel,,từ tháng 4 2023,,84285525,50644,no_type,Mọi loại da,0.9828009828009828,0.03607969843834141,69000.0
Sữa Rửa Mặt Dạng Gel Cosrx Low pH Good Morning Gel Cleanser,"tinh dầu lá tràm trà, bha, ferment, betaine","giúp giảm dầu, thu nhỏ lỗ chân lông, làm dịu da, lấy đi lớp tế bào chết, làm sáng da, dưỡng ẩm cho da, giảm lượng dầu nhờn trên da, làm mềm da",,150 ml,dizzy,cosrx,,hàn quốc,4531785841,78052603,dạng lỏng,"Mọi loại da, Da hỗn hợp",0.9698275862068966,0.14270328486806677,103000.0
Sữa Rửa Mặt Dịu Nhẹ Cetaphil Gentle Skin Cleanser Hasaki Sản phẩm chính hãng,"water, cetyl alcohol, glycol, sodium lauryl sulfate, stearyl alcohol","dùng cho mọi loại da, không gây kích ứng, loại bỏ chất nhờn, tẩy sạch bụi bẩn và trang điểm, giữ độ ẩm, làm mềm và diu da","bị mụn trứng cá, chàm, thể tạng, eczema, rôm sảy, hăm da, ngứa da, khô da, nhạy cảm, vảy cá đỏ, da vẩy, nến bỏng, nắng, viêm da dị ứng, da bị kích thích khi sử dụng benzoyl, làn da mềm mại của trẻ em, da phụ nữ sau sinh, da bệnh nhân tránh bị nhiễm lạnh, da của bé sau ăn bú, da mặt tay và toàn thân",,,cetaphil,,,427028761,18644537,no_type,no_skin,0.958388936066966,0.36995153473344106,232500.0
Sữa Rửa Mặt Cosrx Low PH Good Morning Gel Cleanser 150ml Hàn Quốc / Gel Rửa Mặt Cosrx chiết xuất trà xanh độ PH thấp,"dầu cây trà và các thành phần tự nhiên khác cho công thức tinh khiết nhẹ nhàng. chiết xuất từ cành quả và lá styrax làm dịu làn da nhạy cảm. betaine, bha 0.5 loại bỏ bã nhờn, kem dưỡng sót lại sau 1 đêm và các tế bào da chết","giúp da sạch sâu mà không hề gây cảm giác khô căng, khôi phục lại sự cân bằng ph tối ưu cho da mà không gây kích ứng. làm dịu làn da nhạy cảm, nuôi dưỡng lớp màng acid tự nhiên bảo vệ da.","phù hợp cho mọi loại da, ngay cả làn da nhạy cảm và da mụn",150ml,"dạng gel, có nắp đậy kín",cosrx,hsd 3 năm kể từ ngày sản xuất,thông tin không có,6361336962,333112147,no_type,no_skin,0.9807692307692307,0.01669359181475498,164000.0
SỮA RỬA MẶT GAMMAPHIL 500ml,,"làm sạch và dưỡng da cao cấp, thích hợp cho mọi loại da và đặc biệt cho da mỏng manh nhạy cảm của trẻ sơ sinh và trẻ nhỏ","mọi loại da, đặc biệt thích hợp cho da nhạy cảm",50 ml,,,,,10632382857,73391131,no_type,no_skin,0.9569377990430622,0.053850296176628974,119000.0
Sữa rửa mặt làm sạch ngăn ngừa mụn từ trà xanh 3W CLINIC GREEN TEA CLEANSING FOAM,chiết xuất từ trà xanh,"chống oxy hóa, làm sạch da và diệt khuẩn",mọi loại da,10 ml,,3 w clinic,,hàn quốc,2227684389,138712298,dạng kem,"Mọi loại da, Da hỗn hợp, Bình thường, Dầu, Nhạy cảm",0.9537337662337663,0.13247172859450726,27900.0
"Sữa rửa mặt thảo mộc, ngừa mụn Love Yourself – Đặc biệt an toàn cho mọi làn da, chăm sóc và phục hồi",ngăn ngừa mụn chiết xuất từ lúa mạch việt nam và chiết xuất từ gạo,"an toàn cho mọi làn da, chăm sóc và phục hồi sức sống cho da, giúp lấy sạch bụi bẩn và bã nhờn sâu trong lỗ chân lông, làm sáng da, tạo cảm giác trơn láng mềm mịn sau khi rửa mặt",,,,việt nam,3 năm kể từ ngày sản xuất,công ty tnh mtv mỹ phẩm sắc đẹp việt,22113275689,924631900,dạng sánh,Mọi loại da,1.0,0.007000538502961767,175000.0
Sữa rửa mặt giảm nám và chống tàn nhang thảo dược BAIZTON da trắng sáng và dưỡng ẩm,,giúp làm mờ các mảng nám tàn nhàng và thâm mụn hiệu quả đối với tất cả các loại nám từ nám mảng chân sâu và nám hỗn hợp nám mới hay lâu năm đều có hiệu quả khi sử dụng đủ liệu trình,,,,,,,11497158376,8217147,no_type,no_skin,0.8541666666666666,0.005385029617662897,15000.0
Sữa rửa mặt da dầu mụn La Roche Posay Effaclar Purifying Foaming Gel Cleanser,"nước khoáng la roche posay, kẽm pca","làm sạch bụi bẩn và dầu thừa, giảm mụn, làm dịu da và giảm kích ứng.","phù hợp với mọi loại da, đặc biệt là da nhạy cảm",40ml,"chai nhựa màu trắng đứng, có nắp đậy kín",la roche posay,,pháp,1212657261,8252086,dạng sánh,Mọi loại da,0.9720837487537388,0.06354334948842219,335000.0
"Sữa rửa mặt dưỡng ẩm, ngừa mụn, làm sáng da ý dĩ Hatomugi Nhật Bản 130g, 170g  [xanh - trắng]","myristic acid, stearic acid, peg 8, potasium lauric acid, palmitic acid, glyceryl, glyceryl stearate se, glycol, cetyl alcohol, coix ma yuen sed extract, butylene glycol, aloe leaf extract, prunus persica peach leaf extract, cetyl pg, camelia japonica sed oil, edta, citric acid, sodium","cấp ẩm và dưỡng da tự nhiên, cải thiện là da khô ráp, ngăn ngừa mụn hiệu quả, làm săn chắc da, giúp làm lành các vết thương trên da, ngăn ngừa mụn trứng cá, khống chế lượng dầu se, khít lỗ chân lông, ngăn ngừa lão hóa và dễ dàng thẩm thấu, bảo vệ da khỏi ánh nắng mặt",mọi loại da,130 g,,hatomugi,,nhật bản,14384221562,763202287,no_type,no_skin,0.9155722326454033,0.01669359181475498,46750.0
Sữa Rửa Mặt BIOAQUA Vị Đào Tạo Bọt Nhẹ Nhàng Làm Sạch Dưỡng Ẩm Và Làm Trắng 100gr,,"giải quyết tất cả các vấn đề về da mụn, dịu mụn sưng đỏ, hạn chế mụn mọc trở lại, chống nhờn, cân bằng độ ẩm trên da, làm mờ các vết thâm do mụn gây ra, làm sạch da nhẹ nhàng nhưng hiệu quả","phù hợp với những làn da da dầu, da hỗn hợp, da mụn và da nhạy cảm dễ bị mụn",,,bioaqua,,,13006850994,40424985,no_type,no_skin,0.9515151515151515,0.00436725901992461,13000.0
Sữa Rửa Mặt 3W Clinic Mẫu Mới Hot,chiết xuất chủ yếu từ trà xanh với thành phần chống oxy hóa,"làm sạch da và diệt khuẩn, giảm vùng da bị mụn nám tàn nhang đồi mồi",,10 ml,,3 w clinic,,,457951140,28228365,no_type,no_skin,0.9595327492699207,0.06731287022078622,22500.0
Sữa rửa mặt dạng Gel Decumar Advanced kiểm soát nhờn mụn hoàn toàn mới,"siêu nghệ nano, lá chanh sim, chiết xuất lá nem, chiết xuất lô hội","làm sạch nhẹ nhàng, ngăn ngừa vi khuẩn gây mụn, kiểm soát dầu nhờn, giữ ẩm cho da","mọi loại da, đặc biệt là da dầu và da nhạy cảm, không dị ứng với nghệ",,,decumar,3 năm kể từ ngày sản xuất,"sản xuất tại công ty cổ phần dược mỹ phẩm cvi, lô đất khu công nghiệp công nghệ cao 1, khu công nghệ cao hòa lạc, km 29 đại lộ thăng long, xã thạch hòa, huyện thạch thất, tp hà nội",8138084918,418053645,dạng sánh,"Da mụn trứng cá, Mọi loại da, Khô, Dầu, Nhạy cảm",0.9338235294117647,0.002105546580506193,80000.0
Sữa rửa mặt nhau thai cừu tế bào gốc nhật 130gr,"chiết xuất từ nhau thai cừu, hơn 12 hoạt chất chiết xuất từ thực vật, vitamin và khoáng chất","dưỡng trắng và làm sáng da, giúp da luôn hồng hào căng mịn, cải thiện tình trạng thô ráp da, giữ ẩm, giảm mụn và thâm nám, cân bằng ph da, se khít lỗ chân lông, giảm vết đồi mồi, đốm sâu, tàn nhang",,,,chantele sydney careline,,nhật bản,4593522474,120827064,dạng lỏng,Bình thường,0.959731543624161,0.0030586968228325257,24000.0
Sữa rửa mặt bơ thái,"bơ tự nhiên, thành phần chống oxi hóa","làm sạch bụi bẩn và các tạp chất trên da, giúp da sạch ngăn ngừa mụn nám",mọi loại da,,,,,,1578921134,81341396,no_type,no_skin,0.9504310344827587,0.014539579967689823,30000.0
sửa rửa mặt đông y 100ml,,trắng sáng da nhanh chóng,,,,cherries,,việt nam,15837459228,128835004,no_type,no_skin,0.8888888888888888,0.0005546580506192784,29888.0
Sữa rửa mặt nhau thai cừu,,"giúp trẻ hóa và tăng độ đàn hồi cho da, se khít lỗ chân lông, giúp da mịn màng và căng bóng, làm dịu da sau khi lăn kim pel da đi laser bắn co2, khôi phục và tái tạo da bị tổn thương nhanh chóng",,,,kissing cat,,,10359471737,42940049,no_type,no_skin,0.975,0.000990845449649973,25000.0
"Sữa rửa mặt misswhite mụn, thâm",nghệ tươi,"ngăn ngừa mụn, làm mờ vết thâm",,,,,,,2417637845,131272369,no_type,no_skin,0.9552631578947368,0.014539579967689823,30000.0
Sữa rửa mặt giảm mụn cho da dầu Obagi Clenziderm MD Daily Care Foaming Cleanser 118ml,"acid 2, butyl cetyl disodium edta, menthol, sodium laureth, sodium lauryl, ext violet 2, ci water","làm sạch sâu, loại bỏ dầu bụi bẩn và lớp trang điểm, giúp da thấm sâu các sản phẩm điều trị mụn ở bước tiếp theo, tẩy tế bào chết và ngăn ngừa mụn quay trở lại",,,"sữa rửa mặt dạng kem, đóng trong tuýp nhựa",obagi md,3 năm kể từ ngày sản xuất,mỹ,6731381774,102366617,no_type,no_skin,0.9595588235294118,0.005142703284868067,960000.0
Sữa Rửa Mặt Nhau Thai Cừu 130g,nhau thai cừu,"dưỡng trắng và làm sáng da, sạch sâu từ bên trong, ngăn ngừa vi khuẩn có hại, làm dịu vết thương do mụn, giảm thâm nám, cân bằng ph cho da, cải thiện tình trạng thô ráp da, giữ ẩm",,,,,,,14164894612,40424985,no_type,no_skin,0.95260663507109,0.006462035541195477,22000.0
Sữa rửa mặt đầu cọ tạo bọt Seimy - Face Cleanser Foam Collagen,cung cấp colagen chống lão hóa và kết hợp đầu cọ silicon đa năng,sạch sâu bên trong da gấp 5 lần nâng cơ chống lão hóa giảm mụn đầu đen mụn cám thu nhỏ lỗ chân lông,,,thiết kế đầu cọ tiện dụng giúp chị em tiết kiệm tối đa trong việc skincare mỗi ngày,seimy,,viêt nam,7345679844,292513909,dạng bọt,Mọi loại da,0.967741935483871,0.09154550350026926,87000.0
Sữa Rửa Mặt Cetaphil Gentle Skin Cleanser 473ml.,"chứa các loại cồn béo như glycol, cetyl alcohol, stearyl alcohol","loại bỏ bụi bẩn một cách nhẹ nhàng, không gây khô da, giúp làn da duy trì độ ẩm tự nhiên, giúp duy trì hàng rào bảo vệ da","dành cho mọi loại da, kể cả da người trưởng thành, da khô, da dầu, da mẫn đỏ, da nhạy cảm và da của trẻ sơ sinh","có các loại dung tích 59 ml, 125 ml, 250 ml, 50 ml",,cetaphil,3 năm kể từ ngày sản xuất,canada,15330064796,407501755,dạng lỏng,Mọi loại da,0.8666666666666667,0.0010285406569736134,200000.0
"Sữa rửa mặt CERAVE , da dầu, da mụn, da khô,, mọi loại da. dung tích 236ml","các thành phần giữ ẩm, acid, acid béo","lấy đi bụi bẩn dầu thừa tàn dư của lớp make up mà không làm tổn hại đến lớp màng ẩm của da, giúp duy trì lớp màng bảo vệ da khỏe mạnh để làn da có thể chống lại những tác hại từ môi trường bên ngoài, tránh vi khuẩn xâm nhập vào da, sạch nhưng vẫn mềm mịn","da dầu, da khô",236ml,check mark button,cerave,,,23208227697,217800216,no_type,Mọi loại da,0.8611111111111112,0.045234248788368334,225000.0
[Mã COSACD10 giảm 10% đơn 600K] Gel rửa mặt tạo bọt cho da dầu nhạy cảm La RochePosay 400ml,"zinc pca, nước khoáng thermal spring water","giảm nhờn, điều trị mụn, làm sạch da từ sâu trong lỗ chân lông, loại bỏ bụi bẩn cùng dầu thừa, giữ độ ph luôn ở mức cân bằng 5 5",da dầu và da mụn nhạy cảm,40 ml,"dạng gel, dễ dàng tạo bọt",la roche posay,03 năm kể từ nsx,pháp,1335573348,37251700,dạng sánh,Dầu,0.9317552253840342,0.22670974690360796,489000.0
Sữa Rửa Mặt HadaLabo Advanced Nourish Hyaluron Cleanser 80g,water sodium cocoyl butylene glycol betaine starch peg 20 m lauryl sodium lauroyl potasium cocoyl sodium stearoyl sodium,giúp làm sạch sâu dịu nhẹ dưỡng da ẩm mịn giúp giảm tình trạng mất nước củng cố màng ẩm tự nhiên bảo vệ da,phù hợp với mọi loại da,80 g,,hadalabo,4 năm kể từ ngày sản xuất nsx được in trên bao bì sản phẩm,nhật bản sản xuất tại việt nam,2310205980,45788176,no_type,Mọi loại da,0.9535320977706151,0.10770059235325795,67500.0
