product_name,ingredient,feature,skin_type,capacity,design,brand,expiry,origin,product_id,shop_id,type,skin_kind,is_5_star,num_sold_time,price
Sữa rửa mặt trà xanh 150ml Mẫu Mới,,"làm sạch bã nhờn bụi bẩn tận sâu trong lỗ chân lông, loại bỏ nhẹ nhàng lớp trang điểm và các tạp chất trong lỗ chân lông, cho làn da mịn màng sáng khỏe",hầu hết các loại da kể cả da nhạy cảm,,,seedling,,,19728481883,264988200,no_type,no_skin,0.8333333333333334,0.0005438879913839526,21000.0
Sữa Rửa Mặt Nghệ Mật Ong Collagen X3 Đông Anh 100ml [Hàng Công Ty] Ngừa Mụn - Se Khít Lỗ Chân Lông - Sạch Da,"nghệ, mật ong, colagen","ngừa mụn, se khít lỗ chân lông, sạch da, cấp ẩm, mềm da, tẩy tế bào chết cho da, làm mờ các vết thâm trên da, giảm nám, dưỡng trắng da, đẹp da, mịn da",,10 ml,,đông an,2 năm từ ngày sản xuất,việt nam,20240298687,739912277,no_type,Mọi loại da,0.9444444444444444,0.00030156165858912225,86000.0
Sữa Rửa Mặt Vitamin E Thái Lan 190g,được bổ sung vitamin e,nhẹ nhàng lấy đi bụi bẩn nằm sâu dưới da giúp da láng mịn sáng đẹp,thích hợp mọi loại da ngay cả da nhạy cảm,,,aron,,,15514895814,12325354,no_type,no_skin,0.9696969696969697,0.004894991922455573,24999.0
Sữa rửa mặt cho da dầu mụn SVR Gel moussant,,"làm sạch sâu, giảm mụn, kiềm dầu, tẩy da chết, làm thông thoáng lỗ chân lông, thúc đẩy quá trình trao đổi chất của da và thấm hút tối đa các sản phẩm dưỡng da tốt hơn",dành riêng cho dầu nhạy cảm và có mụn,20 ml và 40 ml,"texture dạng gel, khá ít bọt, có mùi hương táo xanh thư giãn và nhẹ dịu",svr,,từ pháp,11996725093,17218651,no_type,no_skin,0.94,0.0007592891760904685,284000.0
Sữa rửa mặt cho da mụn Sữa rửa mặt hàn quốc 120g làm trắng dưỡng ẩm kiểm soát dầu mụn Làm sạch sâu da,"rau má, rễ cây cốt khí, củ trà, rễ hoàng cầm, hoa cúc và các chất chiết xuất khác","1. làm sạch da, 2. kiểm soát dầu và dưỡng ẩm, 3. loại bỏ mụn đầu đen",,120ml,đầu bàn chải chuyển đổi xoay vòng dễ sử dụng,diamond with a dot,3 năm,,21438426568,706538955,dạng kem,"Da mụn trứng cá, Mọi loại da, Khô, Dầu, Nhạy cảm",1.0,0.00013462574044157243,235000.0
Sữa rửa mặt trà xanh trắng da ngừa mụn Dabo Green Tea Foam Cleanser Hàn Quốc 180ml,"chiết xuất trà xanh, linoleic acid, vitamin e","làm sạch da, loại bỏ cặn bẩn và vi khuẩn hiệu quả, ngăn ngừa mụn, làm chậm quá trình lão hóa da, giúp làn da luôn mềm mại và căng mịn","mọi loại da, đặc biệt là da dầu có mụn",180 ml,,dabo,còn từ 2-3 năm,hàn quốc,9604142139,86443130,dạng kem,"Da mụn trứng cá, Lão hóa, Mọi loại da, Chàm, Bình thường",0.9117647058823529,0.0006623586429725364,95000.0
[Mẫu Mới 2022] Sữa rửa mặt chiết xuất trà xanh Innisfree,"chiết xuất hoàn toàn từ lá trà xanh tự nhiên, kaolin, linoleic acid, vitamin e và các chất khoáng","giúp làm sạch bụi bẩn và các tạp chất trên da, hút nhờn và ngăn ngừa dấu hiệu lão hóa da, tái tạo tế bào da, kiềm dầu và hạn chế mụn da","phù hợp với mọi loại da, đặc biệt phù hợp với da dầu và có mụn",150 ml,,inisfre,,hàn quốc,206448386,17037958,no_type,no_skin,0.9380952380952381,0.00379106085083468,153500.0
SỮA RỬA MẶT GẠO THÁI LAN CIVIC RICE MILK 180ML_ MUA 6 CHAI TẶNG 1 BÁNH XÀ PHÒNG THÁI LAN,sừa gạo và tinh chất colagen,"làm sạch sâu các lỗ chân lông, giữ ẩm và làm mềm da, chống nám sạm và tàn nhang, cân bằng độ ẩm cho da","dầu da, nhạy cảm da bị mụn",180 ml,,civic,,thái lan,953144105,39497707,no_type,no_skin,1.0,0.00014539579967689823,25000.0
Sữa Rửa Mặt Cosrx Low pH Good Morning Gel Cleanser Hàn Quốc 150ml [Chính Hãng] [Mẫu Mới],"chiết xuất từ dầu cây trà và các thành phần tự nhiên khác, bha","làm sạch da nhẹ nhàng, khôi phục lại cân bằng ph tối ưu cho da",,150 ml,sản phẩm có dạng gel tạo bọt nhẹ nhàng,cosrx,,hàn quốc,3840742444,191425325,bột,"Da mụn trứng cá, Mọi loại da, Da hỗn hợp, Khô, Sần",0.967741935483871,0.001050080775444265,119000.0
Sữa rửa mặt bơ Thái Lan 200ML-HÀNG CHÍNH HÃNG CS01,"chiết xuất từ bơ và tinh chất của quả bơ thiên nhiên, hoa quả bơ, sữa gạo","dưỡng ẩm, làm trắng da, làm sạch và se khít lỗ chân lông, giảm tiết nhờn, ngăn ngừa mụn","mọi loại da, đặc biệt là da nhờn",210 g,dạng tuýp màu xanh lá,aron,,nk thái lan,5283814791,411790822,dạng kem,"Mọi loại da, Da hỗn hợp, Nhạy cảm",0.9787234042553191,0.001669359181475498,35000.0
Decumar Clean Gel rửa mặt ngăn ngừa mụn 50gr,"tinh chất nghệ nano, tinh chất lá nem, vitamin e","làm sạch sâu lỗ chân lông, ngăn ngừa và ức chế vi khuẩn gây mụn, duy trì độ ẩm tối ưu cho da","phù hợp với mọi loại da, cả da nhạy cảm",,chiết xuất dạng gel thân nước,decumar,,,1338427283,80007339,no_type,no_skin,0.9525691699604744,0.004302638664512655,64500.0
Sữa rửa mặt Vedette Than Hoạt Tính 100ml (TPMA284),bôt than hoạt tính tự nhiên từ than sồi than tre,"thanh lọc sạch sâu cặn bẩn bã nhờn độc tố nằm sâu trong lỗ chân lông, giúp thanh lọc da, ngăn ngừa mụn đầu đen, mụn ẩn, đặc biệt phù hợp cho làn da đô thị thường xuyên tiếp xúc với môi trường ô nhiễm khói bụi",,,,vedete,3 năm kể từ ngày sản xuất,việt nam,11276070299,80528748,dạng kem,Mọi loại da,0.98,0.004356488960689284,79000.0
[MẪU MỚI] Sữa rửa mặt Pond's White Beauty trắng hồng rạng rỡ 100g,"glycerin, b3","loại bỏ hiệu quả lớp bãnhờn và tế bào chết từ sâu bên trong lỗ chân lông cho da thật sạch và tươi sáng, bổ sung độ ẩm cùng dưỡng chất dưỡng trắng tự nhiên cho da dần trở nên trắng hồng rạng rỡ",phù hợp mọi loại da,,,pond's,,,6110064417,205083574,dạng kem,"Lão hóa, Mọi loại da, Da hỗn hợp",1.0,9.693053311793215e-05,55000.0
Sữa rửa mặt Làm sạch sâu - Cấp nước - Dưỡng ẩm sâu Images Milk Hydrating Cleanser 120ml,chiết xuất từ sữa bò tươi,"làm sạch da, cấp nước, dưỡng ẩm sâu",,120 ml,"mới, có vòi lấy sữa rửa mặt tiện dụng",,,nội địa,8217726096,79285599,no_type,no_skin,0.9523809523809523,0.0003500269251480883,29750.0
"Sữa rửa mặt La Roche - Posay Effaclar 50ml - 400ml cho da dầu, mụn, nhạy cảm.","nước, glycerin, coco-betaine, zinc pca, sodium laureth sulfate, citric acid, cocamide mea, pegasus-150 distearate, poloxamer 4, sodium chloride, sodium benzoate, sodium hydroxide, phenoxyethanol..","loại bỏ cặn trang điểm, kiểm soát bã nhờn, giảm mụn trứng cá, bảo vệ làn da nhạy cảm khỏi kích ứng, cân bằng độ ph cho da, duy trì độ ẩm ổn định cho da",da dầu và da mụn nhạy cảm,50ml hoặc 40ml,"chai nhỏ gọn, thiết kế đơn giản, dễ sử dụng",la roche-posay,,pháp,4172751678,33539570,no_type,no_skin,0.9705882352941176,0.0015131933225632742,220000.0
"Sữa Rửa Mặt Bạc Hà Kiềm Dầu Drlacir dr lacir ,chai 150ml,Phù hợp với da dầu,da mụn, kiểm soát dầu nhờn","chiết xuất cây phỉ, chiết xuất bạc hà, chiết xuất nha đam","kiềm dầu, làm sạch da, ngăn ngừa mụn, cấp ẩm cho da",da tiết nhiều dầu,,thiết kế đặc biệt với dầu cọ silicol thông minh,dr lacir,,,16354005991,419847663,dạng kem,"Da mụn trứng cá, Lão hóa, Mọi loại da, Da hỗn hợp, Nhạy cảm",0.8055555555555556,0.0006515885837372105,120000.0
Kem rửa mặt sáng da - mờ sẹo & vết thâm Acnes Vitamin Cleanser 50g,kết hợp các vitamin cần thiết cho làn da như vitamin e c a b3 b5 b6,"rửa trôi bụi bẩn ngừa khuẩn mụn trở lại, giúp da sáng khỏe mờ dần vết thâm sau mụn, mô sợi colagen trở nên săn chắc hơn",,50 g,,acnes,,sản xuất tại việt nam,1958615920,65616143,no_type,no_skin,1.0,0.00012385568120624663,32000.0
Sữa rửa mặt Esunvy,"water, glycerin, alcohol, butylene glycol, peg/pgg-17/6 copolymer, peg-60 hydrogenated castor oil, phenoxyethanol, chlorphenesin, sodium citrate, citric acid, citrus aurantium bergamia (bergamot) fruit oil, disodium edta, sodium sulfate, ci 19140, ci 14700, fragrance","làm sạch bụi bẩn, làm sạch sâu tận lỗ chân lông, loại bỏ dầu trên da, giúp loại bỏ vi khuẩn gây mụn, ngăn ngừa các loại mụn (trứng cá, viêm, cám, đầu trắng, đầu đen, mủ, bọc), chăm sóc và phục hồi các tổn thương do mụn, làm mờ vết thâm sẹo, giúp cân bằng độ ẩm tự nhiên của da, chăm sóc da mịn màng",mọi loại da,150ml,"chai nhựa, dạng lỏng",sakura,24 tháng kể từ ngày sản xuất,hàn quốc,10819321753,47958367,no_type,no_skin,1.0,0.0005546580506192784,49000.0
Sữa rửa mặt 3W Clinic chính hãng Hàn quốc 100ml ( mẫu mới),chiết xuất từ thiên nhiên,"chăm sóc và phục hồi sức sống cho da, làm se khít lỗ chân lông, giảm mụn, giúp da trắng sáng hồng tự nhiên",mọi loại da,,,3 w clinic,,hàn quốc,80727864,5731552,dạng sánh,"Mọi loại da, Da hỗn hợp",0.9748549323017408,0.02207862143241788,25000.0
Sữa rửa mặt Kone' Thái Lan chuẩn [Chính Hãng],,,,,,,,,13049418879,38397811,no_type,no_skin,0.9512195121951219,0.0024986537425955844,17500.0
Sữa rửa mặt trà xanh (inisfree mãu mới).,,,,,,inisfre,,hàn quốc,12950803944,19892101,dạng kem,Mọi loại da,0.8,6.462035541195476e-05,23000.0
[120mL] SỮA RỬA MẶT QUATID PHÙ HỢP DA DẦU MỤN,,"làm sạch thông thoáng lỗ chân lông, phù hợp với da dầu, da hỗn hợp da mụn, hỗ trợ giảm dày sừng nang lông","da dầu, da hỗn hợp da mụn",120 ml,,quatid,,việt nam,5161123672,20018783,dạng sánh,"Da mụn trứng cá, Mọi loại da, Da hỗn hợp",0.9888888888888889,0.0017609046849757673,100000.0
(Mẫu Mới) Sữa Rửa Mặt Chiết Xuất Từ Trà Xanh INNISFREE Green Tea Hydrating Amino Acid Cleansing Foam - 150ml,chiết xuất từ trà xanh,"làm sạch bụi bẩn, hút nhờn, làm sáng, chống oxy hóa, giảm mụn","dành cho mọi loại da, đặc biệt da dầu có mụn",1,mẫu mới,inisfre,,"sản xuất ngay tại cánh đồng trà xanh trên đảo jeju, hàn quốc",7420811655,174555522,dạng kem,"Da mụn trứng cá, Da hỗn hợp, Dầu",1.0,0.0025471190091545504,179000.0
Sữa rửa mặt dưỡng trắng Acnes Pure White Cleanser,"phức hợp c boster và alpinia white, aha và bha, acid","dưỡng trắng mịn màng, an toàn cho da, ngừa khuẩn mụn, nuôi dưỡng da tươi sáng mịn màng từ bên trong, làm giảm sự hình thành và làm mờ sắc tố melanin, dưỡng da trắng mịn và ngăn chặn tác động của tia uv lên da, rửa sạch chất nhờn dư và bụi bẩn nhẹ nhàng, lấy đi lớp sừng già, ngăn ngừa khuẩn mụn, tăng cường độ đàn hồi cho làn da ẩm mượt sáng khỏe",,,,acnes,nan,,6238836408,17200692,dạng kem,"Da mụn trứng cá, Bình thường, Dầu",0.9735099337748344,0.003887991383952612,65000.0
Sữa Rửa Mặt Hazeline Tuýp 50g/100g,"chiết xuất nghệ, kiwi, khoáng chất, và vitamin","loại bỏ dầu nhờn, vi khuẩn ngăn ngừa mụn và mụn trứng cá, giúp da sạch sáng hơn","có xu hướng tiết dầu, lỗ chân lông bị bịt kín, da xỉn màu thiếu sức sống",50g,tuýp,hazeline,,việt nam,7700184947,178461450,no_type,no_skin,0.9770114942528736,0.0010662358642972536,39350.0
"[Có Bill] Sữa Rửa Mặt Ý Dĩ Hatomugi Nhật Bản - Trắng Da, Sạch Sâu, Giảm Mụn",hạt ý dĩ và một số thành phần phụ như lúa mạch đào vitamin,"thẩm thấu sâu dưới lớp hạ bì, dưỡng ẩm cho da hiệu quả, khống chế lượng dầu, chống cháy nắng, cải thiện làn da khô, chống lão hóa da, ngăn ngừa vết nhăn, chống chảy xệ, làm sạch mụn, giảm mụn, se khít lỗ chân lông, hạn chế bã nhờn, làm trắng sáng da, mờ thâm",da màu xanh,170 g,hộp nhỏ gọn,hatomugi,,nhật bản,9110627715,227617736,dạng lỏng,"Da mụn trứng cá, Mọi loại da, Dầu, Nhạy cảm",1.0,0.00013462574044157243,67000.0
Sữa rửa mặt Ý Dĩ Hatomugi Naturie Nhật Bản,"chiết xuất ý dĩ, lúa mạch, bột ngọc trai, quả đào","rửa sạch bụi bẩn, giảm sưng tấy, làm mịn màng da, ngăn ngừa mụn, chống lão hóa, làm săn chắc da","phù hợp với mọi loại da, đặc biệt là da dầu và da mụn",145ml,"chai nhựa dẻo, đơn giản, tiện lợi",naturie,in trên bao bì sản phẩm,nhật bản,3351155863,23232210,dạng kem,"Da mụn trứng cá, Mọi loại da",0.9090909090909091,0.0002261712439418417,47000.0
SỮA RỬA MẶT GẠO BROWN RICE FOAM CLEANSING 3W CILINIC HÀN QUỐC 100ML,"chiết xuất từ lúa mạch, các hạt bọt li ti","làm sạch và loại bỏ các tạp chất trên da, làm trắng mịn da",an toàn cho mọi loại da,10 ml,đơn giản và thuần khiết tự nhiên,3w clinic,,hàn quốc,597043869,29559718,no_type,no_skin,0.9613899613899614,0.0053527194399569196,35000.0
"Gel rửa mặt Compliment No Problem giảm viêm, mụn 200ml",,"giảm mụn, giảm viêm, ngăn ngừa mụn quay trở lại, loại bỏ bụi bẩn từ lỗ chân lông, ngăn chặn sự xuất hiện của các bả nhờn và mụn đầu đen, cung cấp ẩm lâu dài, se khít lỗ chân lông",dành cho da mụn,20 ml,sửa rửa mặt dạng gel trong suốt,no problem,,nga,4393343782,8516029,no_type,no_skin,0.9836065573770492,0.0015778136779752289,95000.0
Sữa Rửa Mặt Sulwhasoo Gentle Cleansing Foam 200ml Dịu Nhẹ Phù Hợp Với Mọi Loại Da,,"dịu nhẹ, phù hợp với mọi loại da, nhẹ nhàng loại bỏ tế bào chết mà không gây kích ứng da, tạo lớp dưỡng ẩm mỏng nhẹ cho làn da mịn màng sáng khỏe, bổ sung và duy trì độ ẩm lâu dài giúp da không bị khô sau khi rửa mặt",phù hợp với mọi loại da,20 ml,,sulwhaso,,,5195313517,7413406,no_type,"Mọi loại da, Da hỗn hợp",1.0,0.0002530963920301562,459000.0
Sữa Rửa Mặt Call Me Cleanser,"chất hoạt động bề mặt dịu nhẹ, chiết xuất xương rồng, lá trà xanh, gốc glycol","làm sạch, làm dịu, giữ ẩm, chống oxy hóa",mọi loại da,,gel,,,,17513986860,698592605,dạng gel,Mọi loại da,1.0,0.000942380183091007,239000.0
[Hàng Mỹ] Sữa rửa mặt Olay Regenerist /Luminous /Total Effects Face Cleanser (150ml),"chứa đến 50 lượng kem dưỡng ẩm, glycerin, vitamin b5 và vitamin e","làm sạch sâu các lỗ chân lông, loại bỏ bụi bẩn và lớp trang điểm trên da với công thức chống lão hóa, bổ sung độ ẩm để làm mềm da và tăng độ trắng sáng, giảm thiểu vết thâm cho bạn làn da mịn màng đầy sức sống",,,"màu đỏ, dạng kem",olay,,,3506178471,52171839,no_type,no_skin,0.8970588235294118,0.001362412493268713,174500.0
Sữa rửa mặt rau củ💖FREESHIP💖Sữa rửa mặt thải độc Super Vegitoks Cleanser 300ml,"chiết xuất từ rau củ, vitamin, khoáng chất, chiết xuất tảo xoắn, chiết xuất bông cải, chiết xuất chanh, trà xanh, chiết xuất bơ, chiết xuất lúa mì, cần tây, su hào, lá diếp xoăn, chiết xuất cà chua, chiết xuất lựu, chiết xuất cà rốt, chiết xuất dâu tây, chiết xuất việt quất, chiết xuất củ dền, chiết xuất cà tím, chiết xuất từ nho","tẩy trang, rửa mặt, mặt nạ, thải độc","da dầu, hỗn hợp thiên dầu, mọi loại da",,,super vegitoks,,,8964547059,459312258,dạng sánh,Mọi loại da,0.967391304347826,0.0013947226709746905,173000.0
Chai đựng sữa rửa mặt tạo bọt có đầu mát xa (100ml),chất liệu nhựa đầu tạo bọt bằng silicone,có chức năng mát xa da mặt cực kỳ hiệu quả,,dung tích,,,,,7476769275,29023517,no_type,no_skin,0.9047619047619048,0.0018039849219170705,21500.0
Combo 2 Sữa rửa mặt chiết xuất Than Hoạt Tính 3W Clinic Hàn Quốc trắng da sạch sâu & ngừa mụn 100ml x2 Lọ,thành phần từ thiên nhiên như sâm linh chi,"khử khuẩn, khử các bã nhờn, khử mùi, khử các chất độc trên da, chống lại tia tử ngoại khi đi nắng, giúp làm sạch sâu bã nhờn cùng lớp dầu thừa để ngăn chặn sự hình thành mụn cám, mụn đầu đen, làm da luôn mịn màng trắng sáng và làm săn chắc làn da của bạn",mọi loại da,10 mlx 2 lọ,,3 w clinic,,hàn quốc,16322184366,323611095,dạng kem,"Da mụn trứng cá, Lão hóa, Mọi loại da, Da hỗn hợp, Bình thường",0.8823529411764706,0.00016693591814754982,90000.0
Sữa rửa mặt Collagen Senka Perfect Whip Collagen In 120G ngăn ngừa lão hóa giảm nếp nhăn,"tinh chất colagen và 60 thành phần là tinh chất dưỡng da, chiết xuất tơ tằm trắng, gấp đôi acid","làm sạch bụi bẩn và bã nhờn sâu trong lỗ chân lông, giúp da săn chắc đàn hồi, làm mờ nếp nhăn vết chân chim, hạn chế tình trạng chảy xệ da, duy trì lớp màng dưỡng ẩm tự nhiên, giúp da sáng mịn và mềm mượt",,120 g,,senka,3 năm kể từ ngày sản xuất,thương hiệu nhật bản,9694247088,540766923,no_type,no_skin,0.9666666666666667,0.001470113085621971,88000.0
Sữa rửa mặt TFS Herb Day 365 Cleansing Foam The Face Shop 170ml,,"có thể dùng nó như kem tẩy trang, làm sáng da, tăng độ ẩm cao cho da, se khít lỗ chân lông to, phục hồi và tái tạo cho làn da hồng hào tự nhiên, loại bỏ bã nhờn và sừng chết lâu ngày trên da, làm cho da sáng và mịn màng",,170 ml,tuýp,the face shop,,hàn quốc,1667933701,91502846,no_type,no_skin,1.0,0.0008185245018847604,84000.0
[DATE MỚI-CHÍNH HÃNG]Sữa rửa mặt trắng sáng da NEOTONE GEL ISIS PHARMA dành cho da nhạy cảm và da thường,,"tẩy tế bào chết, nuôi dưỡng và tái tạo lại hàng rào bảo vệ da nhẹ nhàng",dành cho da nhạy cảm và da thường,40 ml hoặc 150 ml,,isis pharma,,pháp,4147304247,139743620,no_type,no_skin,0.9594594594594594,0.0012870220786214324,272499.5
[15 - 27.12 - Giảm sốc] Sữa rửa mặt kèm tẩy trang 2in1 Naive Nhật bản chiết xuất trà xanh 200g,chiết xuất lá trà xanh và dầu hạt nho,loại bỏ hoàn toàn lớp trang điểm bụi bẩn đồng thời diệt khuẩn hạn chế nguy cơ gây mụn chống lão hóa da,phù hợp cho da dầu nhờn,20 g,nồi bật,kraice naive,3 năm kể từ ngày sản xuất,nhật bản,1827305236,88913779,no_type,no_skin,0.6666666666666666,0.0003769520732364028,145000.0
Tuýp sữa rửa mặt CNP Laboratory,"chứa các thành phần ceramide, chiết xuất quả lựu, quả sung, rễ cây mã đề và chiết xuất lá tía tô đất","làm sạch hoàn hảo cặn bã và bụi bẩn trên trên da, giữ ẩm tự nhiên, giảm thiểu kích ứng mà không làm da bị khô sau khi rửa mặt",phù hợp với mọi loại da,,,cnp,in trên sản phẩm,hàn quốc,9926802720,12211240,dạng kem,no_skin,1.0,0.0006408185245018848,59000.0
Sữa rửa mặt Cetaphil Gentle Skin Cleanser [Chính Hãng],water cetyl alcohol glycol sodium lauryl sulfate stearyl alcohol,"làm sạch da một cách an toàn, không gây kích ứng",tốt cho mọi loại da,,,cetaphil,03 năm từ ngày sản xuất in trên bao bì sản phẩm,,7891293417,452520503,dạng sánh,"Da hỗn hợp, Khô, Bình thường, Dầu, Nhạy cảm",1.0,0.00032310177705977385,221500.0
Sữa Rửa Mặt Mamonde Các Loại Da,chiết xuất từ hoa sen,"phục hồi và tái tạo da, tăng cường đề kháng, giữ ẩm và thanh lọc da",,15ml hoặc 50ml,"ở dạng hơi lỏng, có khả năng tạo bọt nhiều, dùng cực thích",mamonde,,,10411137752,51381266,no_type,no_skin,1.0,9.154550350026925e-05,80000.0
🌲Gel rửa mặt Simple Kind to Skin Refreshing Facial Wash size mini (Bill UK),sự hòa hợp hoàn hảo giữa các thành phần,"làm sạch da nhẹ nhàng mà không mất đi độ ẩm tự nhiên của da, trả lại làn da mềm mại tươi mát, giảm nguy cơ hình thành mụn trứng cá và mụn đầu đen",phù hợp với mọi loại da kể cả da nhạy cảm,mini,đặc trưng của hãng simple màu xanh lá rất tươi mát,simple,,uk,1122614376,60366979,no_type,no_skin,1.0,5.385029617662897e-05,90000.0
[chính hãng]Sữa rửa mặt hoa quả thải độc(200-300ml),"super vegitoks (chiết xuất từ 10 loại rau củ), tảo xoắn, nước trà xanh, bơ, cần tây, su hào, chanh, cà chua, lá bạc hà","tẩy trang, rửa mặt, thải độc tố, cung cấp dinh dưỡng, dưỡng da mềm mại, tươi sáng","dành cho mọi loại da, đặc biệt là da nhạy cảm",30 ml,,byvibes wonder bath,,hàn quốc,7822051552,226541539,no_type,no_skin,0.9791666666666666,0.0005923532579429187,190000.0
Các loại mẫu thử của Cerave,,,"da dầu, da khô, da mụn",20ml,,cerave,,,8468401225,47684964,dạng kem,Mọi loại da,0.9761904761904762,0.001103931071620894,20000.0
"[Mã BMLT30 giảm đến 30K đơn 299K] Sữa rửa mặt Dermarium Good Night Cleanser dạng gel, chứa than hoạt tính 140ml","than hoạt tính, lactic acid aha","làm sạch da hiệu quả, loại bỏ bụi bẩn bã nhờn trên bề mặt da, thay mới tế bào sừng, hỗ trợ giảm mụn ẩn mụn đầu đen mụn viêm mà không khiến da kích ứng hay tổn thương hơn",,,,,,,21015641183,776074609,dạng sánh,Mọi loại da,1.0,0.00028002154011847065,150000.0
SỮA RỮA MẶT LÁRE 3 IN 1,"chiết xuất từ rau má hữu cơ, bạc hà hữu cơ, rau diếp cá hữu cơ, trà xanh hữu cơ","tẩy trang, rửa mặt, sạch mát, cân bằng độ ph cho da",tất cả mọi loại da,,,nhà láre,,,5351706353,286649027,dạng lỏng,Mọi loại da,1.0,0.00032310177705977385,260000.0
"Sữa Rửa Mặt Dạng Gel Làm Dịu Da Chiết Xuất Xương Rồng Huxley Secret Of Sahara Cleansing Gel ; Be Clean, Be Moist 200ml","chiết xuất từ xương rồng và dầu hạt xương rồng hữu cơ, axit lượng vitamin e, aloe vera, axit acid, vitamin c, tinh chất centela, vỏ cây phỉ betula alba","làm dịu da bị dị ứng, tăng khả năng giữ nước cho da, dưỡng ẩm sâu, se khít lỗ chân lông, hồi phục và trẻ hóa làn da, chống oxy hóa mạnh, chống khuẩn cho da, giảm thiểu hình thành mụn và sưng, làm dịu làn da bị kích ứng, giữ ẩm tuyệt vời","thích hợp với làn da nhạy cảm, da dễ bị kích ứng",20 ml,"dạng gel dịu nhẹ, có độ ph 5.5",huxley,3 năm kể từ ngày sản xuất,hàn quốc,7643537406,58535628,no_type,Mọi loại da,1.0,0.00012924071082390953,295000.0
"[COMBO SIMPLE] Bộ 3 Nước Tẩy Trang, Sữa Rửa Mặt, Toner Simple (Hàng chính hãng)",chứa b5 và vitamin e,"giúp da sạch thoáng, giữ ẩm và mềm mịn",phù hợp cho mọi loại da,,,simple,03 năm kể từ ngày sản xuất,poland,14915301155,453810084,dạng lỏng,Mọi loại da,0.972972972972973,0.0003177167474421109,80000.0
Sữa Rửa Mặt Biore Sạch Nhờn & Lỗ Chân Lông Nhỏ Mịn 100g,water palmitic acid stearic acid acid myristic acid potasium glycol lauric acid decyl kaolin disodium edta menthol,"hỗ trợ se nhỏ lỗ chân lông, làm sạch sâu, độ ẩm giúp da căng mọng mịn màng",,,,bioré,3 năm kể từ ngày sản xuất,nhật bản,8362840413,412741369,no_type,no_skin,0.9622641509433962,0.0008131394722670974,55000.0
Sữa rửa mặt sữa chua olic-Sữa rửa mặt olic trắng da,,"giúp khắc phục cực tốt và an toàn trong việc vệ sinh làm sạch bề mặt da, kháng khuẩn, giúp da luôn thông thoáng và đặc biệt sẽ giúp da duy trì độ ẩm tự nhiên, kiểm soát bã nhờn, se khít lỗ chân lông",,,,"xuất sứ việt nam, thương hiệu olic",,,15717051703,607039227,dạng lỏng,"Da mụn trứng cá, Mọi loại da, Da hỗn hợp, Khô, Nhạy cảm",0.9814814814814815,0.0012385568120624663,50000.0
Sữa rửa mặt bơ Thái lan,"bơ tươi, thành phần chiết xuất từ thiên nhiên","dưỡng ẩm, làm trắng da, se khít lỗ chân lông",phù hợp với mọi loại da,,,aron,,thái lan,18111675259,22030358,no_type,Mọi loại da,1.0,0.0009100700053850296,38000.0
