product_name,ingredient,feature,skin_type,capacity,design,brand,expiry,origin,product_id,shop_id,type,skin_kind,is_5_star,num_sold_time,price
MÃ FSSSBD29 giảm 15k đến 00h 29.4[HÀNG CHÍNH HÃNG] SỮA RỬA MẶT CETAPHIL,water cetyl alcohol glycol sodium lauryl sulfate stearyl alcohol,"làm sạch, loại bỏ chất nhờn và trang điểm, giữ ẩm, làm mềm da","mọi loại da, đặc biệt là da nhạy cảm, da bị mụn trứng cá, chàm, eczema, rôm sảy, hăm da, ngứa, da khô, vảy cá đỏ, da vẩy, nến bỏng, viêm da dị ứng, chàm tiếp xúc, da bị lão hóa, nám da, da da bị kích thích khi sử dụng benzoyl",,,cetaphil,,canada,6004945386,36559034,khác,Mọi loại da,0.9638267491670633,0.11039310716208939,211000.0
"[COMBO SIMPLE] Bộ 3 Nước Tẩy Trang, Sữa Rửa Mặt, Toner Simple","nước tẩy trang simple micelar water chứa vitamin b3, vitamin c và nước cất 3 lần tinh khiết; sữa rửa mặt simple chứa vitamin b5 và vitamin e; nước hoa hồng simple toner chứa vitamin b5, chiết xuất cây hazel và chiết xuất thực vật","làm sạch trang điểm, bụi bẩn và cung cấp dưỡng chất cho da, cân bằng độ ẩm cho da, làm sáng da, làm mềm mịn da","phù hợp cho mọi loại da, kể cả làn da nhạy cảm","nước tẩy trang 400ml, sữa rửa mặt 150ml, nước hoa hồng 200ml",,simple,03 năm kể từ ngày sản xuất,poland,10573962589,599996037,no_type,no_skin,0.9090909090909091,0.00013462574044157243,164500.0
"Sữa Rửa Mặt Tràm Trà Sạch Sâu, Kiềm Dầu Derladie Herbal Extract Care Deep Cleansing Foam",phức hợp 4 loại acid cùng 10 loại chiết xuất từ thiên nhiên,làm sạch sâu hỗ trợ kiềm dầu và giảm mụn hiệu quả,thích hợp cho mọi làn da đặc biệt là da hỗn hợp thiên dầu da dầu mụn,150 ml,chai nhựa màu trắng dạng xịt,derladie,,hàn quốc,11290061460,181158498,no_type,no_skin,0.9722222222222222,0.0016962843295638126,109000.0
"SỮA RỬA MẶT ADAPHIL DỊU NHẸ LÀNH TÍNH, NGỪA MỤN",,làm sạch và dưỡng da cao cấp không giống như xà phòng không chứa không chưa hương liệu và không tạo nhân trứng cá thích hợp cho cả da nhờn da khô và đặc biệt là làn da mỏng manh nhạy cảm của trẻ sơ sinh và trẻ nhỏ,,50 ml,,adaphil,,việt nam,4389463015,364668808,no_type,no_skin,1.0,2.6925148088314486e-05,120500.0
Sữa rửa mặt Bio Sebium Purifying Cleansing Foaming Gel 200ml,"coper sulfate, kẽm, chiết xuất lá bạch quả, ginkgo biloba leaf","làm sạch sâu, giảm khả năng phát sinh mụn, cân bằng lượng dầu trên da, cân bằng độ ẩm tự nhiên cho da","cho da hỗn hợp da dầu mụn, mọi loại da, da nhạy cảm, da khô",20 ml,sữa rửa mặt dạng gel,bio,,pháp,21707827826,785481113,gel,"Mọi loại da, Da hỗn hợp, Khô, Dầu, Nhạy cảm",1.0,0.0005815831987075929,222000.0
Sữa rửa mặt Mamonde Lotus Micro Deep Cleansing Foam 15ml [date 2023],chiết xuất từ hoa sen,"phục hồi và tái tạo hư tổn dưới da, tăng cường đề kháng cho da, giữ ẩm và thanh lọc da, loại bỏ các tạp chất có hại trên da",,50 ml,"dạng hơi lỏng, tạo bọt nhiều bọt nhỏ",four leaf clover,,,3517595213,191425325,bột,"Da mụn trứng cá, Lão hóa, Mọi loại da, Da hỗn hợp, Bình thường",0.9903381642512077,0.0053527194399569196,22500.0
Sữa rửa mặt giảm mụn 2% BHA - ZAPZYT Acne Wash,acid,"giảm mụn, cải thiện lỗ chân lông, loại bỏ tế bào chết, ngăn ngừa mụn tấn công, làm sáng da",,,chất gel,,,,18612644009,407022,no_type,no_skin,0.9642857142857143,0.0031233171782444804,140000.0
Sữa rửa mặt dịu nhẹ COSRX pH Good Morning Gel Cleanser 50ml/150ml,"dầu cây trà, chiết xuất nấm men, chiết xuất lá tràm trà, bha beta hydroxy acid, alantoin, betaine","làm sạch da hiệu quả mà không hề khô căng, giúp se khít lỗ chân lông, tẩy da chết nhẹ nhàng, giảm viêm da, kiểm soát lượng dầu nhờn trên da","phù hợp với mọi loại da, đặc biệt là da nhạy cảm",300ml,"kết cấu dạng gel tạo bọt nhẹ, thiết kế gọn nhẹ tiện lợi",cosrx,3 năm kể từ ngày sản xuất,hàn quốc,694389549,979943,dạng sánh,Mọi loại da,0.978441127694859,0.08131394722670975,149000.0
Sữa Rửa Mặt Neutrogena Oil-Free Acne Wash Pink Grapefruit Foaming Scrub,2 acid,"giảm mụn đồng thời tăng độ thông thoáng của tế bào da, bảo vệ da khỏi các tác nhân gây hại",da dầu,,hộp nhựa,neutrogena,,mỹ,10744558623,83560523,no_type,no_skin,0.9841269841269841,0.0011900915455035003,128000.0
Sữa rửa mặt Nuno Ziaja dành cho da dầu mụn - Ziaja Nuno 200ml,,"làm sạch sâu da, hạn chế sự phát triển của vi khuẩn, khắc phục sự biến đổi của mụn bọc, mụn cám, mụn trứng cá, chăm sóc da hiệu quả không gây tắc lỗ chân lông, không làm ảnh hưởng đến lớp bảo vệ da, không gây khô da","da mụn, da dầu hỗn hợp",,,ziaja,,,4856781781,318200249,dạng gel,"Da mụn trứng cá, Mọi loại da, Da hỗn hợp, Dầu, Nhạy cảm",0.9578059071729957,0.007000538502961767,139000.0
[Minisize] Gel rửa mặt tạo bọt La Roche-Posay Effaclar cho da dầu nhạy cảm 15ml - Xanh,"zinc pidolate, nước khoáng","làm sạch bụi bẩn và bã nhờn dư thừa, giúp kiểm soát bã nhờn dư thừa trên da, chứa thành phần giúp thanh tẩy và làm dịu da",độ ph trung tính,15 ml,,l'oreal,3 năm từ nsx,pháp,14235201820,258099521,dạng lỏng,"Dầu, Nhạy cảm",0.8571428571428571,0.00027463651050080773,45000.0
Sữa Rửa Mặt Reihaku Hatomugi Facial Foam 130g và 170g,hạt ý dĩ,"cung cấp độ ẩm và dưỡng chất cho da, giúp làm sạch bụi bẩn bã nhờn và làm sáng da, cải thiện làn da khô ráp, giúp da đàn hồi hơn, ngăn ngừa mụn, dưỡng trắng da để da mịn màng sáng hồng tự nhiên",,,,reihaku,3 năm từ nsx,nhật bản,8450682149,407614116,no_type,Mọi loại da,1.0,0.0003554119547657512,54500.0
Sữa Rửa Mặt Hatomugi Naturie Hạt Ý Dĩ 130g Nhật Bản,"lúa mạch, bột ngọc trai quả đào, khoáng chất, vitamin b","làm sạch da, giảm sưng tấy cho da có mụn trứng cá, ngăn ngừa vết nhăn, chống lão hóa da, se khít lỗ chân lông, hạn chế bã nhờn, làm trắng sáng da",khô,nan,nan,nhatban,nan,nan,2209295083,138806876,no_type,no_skin,0.9591836734693877,0.0015616585891222402,47000.0
Gel Rửa Mặt Không Chứa Xà Phòng SVR Sebiaclear Gel Moussant 50ml,"hoạt chất và mat sr, phức hợp dưỡng ẩm độc quyền","làm sạch nhẹ nhàng, không gây tổn hại cho da, thông thoáng lỗ chân lông, loại trừ các chất bẩn và lượng bã nhờn dư thừa, nuôi dưỡng làn da từ bên trong, ngăn chặn cảm giác da bị căng",nhạy cảm,50ml,dạng gel,svr,3 năm,pháp,4609888049,193849872,no_type,no_skin,0.9333333333333333,0.000570813139472267,140000.0
sữa rửa mặt nha đam e100ml,nha đam,"dịu nhẹ, phù hợp với mọi loại da, nhạy cảm; nhẹ nhàng rửa sạch vết bẩn, tránh gây khô da; giá thành bình dân, phù hợp mọi làn da",mọi loại da,,,,,,4793604589,156610565,no_type,no_skin,0.9325842696629213,0.0047711362412493265,25000.0
Sữa rửa mặt sạch mụn ngăn ngừa bít tắc lỗ chân lông Bioderma Sébium Gel Moussant 100ml/200ml,"sodium laureth sulfate, disodium edta, manitol, xylitol, zinc sulfate, copper sulfate, ginkgo biloba leaf extract, peg 90 glyceryl, lactic acid, potassium sorbate, sodium glycol, sodium bi 418","làm sạch nhẹ nhàng và ngăn chặn hình thành mụn, ngăn ngừa bít lỗ chân lông, làm tiết bã nhờn, chống oxy hóa","dành cho da dầu, da hỗn hợp và da mụn",,,,04 2023,,4750721383,14879703,dạng lỏng,Mọi loại da,0.9770114942528736,0.00094776521270867,306000.0
[Hàng mới về] Sữa rửa mặt LIFUSHA trà xanh dưỡng ẩm kiềm dầu giúp sáng da,,"làm sạch bọt đặc, kiểm soát dầu dưỡng ẩm làm sạch sâu làm mềm da",mọi loại da,khối lượng tịnh 80 g,,lifusha,ba năm,nội địa,8379963419,379849017,dạng sánh,"Da mụn trứng cá, Mọi loại da, Da hỗn hợp, Sần, Chàm",0.9487179487179487,0.0005654281098546042,29425.0
[Hàng Pháp] Sữa rửa mặt Bioderma Sebium Cleansing Foaming gel 200ml,"kẽm, copper sulfate, chiết xuất lá bạch quả ginkgo biloba leaf","giúp làm sạch sâu, thu nhỏ lỗ chân lông, giảm sự hình thành mụn, tiêu diệt vi khuẩn gây mụn, làm dịu tổn thương do mụn, ức chế da tiết dầu, chống oxy hóa, kích thích lưu thông tuần hoàn máu",da dầu hỗn hợp thiên dầu,20ml,"là sản phẩm sữa rửa mặt dạng gel, không gây khô da, lành tính, không chứa paraben, không chứa cồn, không chất bảo quản",bio,,pháp,19249022927,43873741,dạng lỏng,Mọi loại da,1.0,0.0005600430802369413,215000.0
Gel rửa mặt SVR Sebiaclear/ Topialyse Gel Moussant làm sạch và loại bỏ tế bào da chết 55ml,,"làm sạch nhẹ nhàng, làm thông thoáng làn da, khả năng tạo bọt mịn, loại trừ các chất bẩn và lượng bã nhờn dư thừa mà không làm khô da, giảm tắc nghẽn lỗ chân lông, làm mềm mại cho da hỗn hợp đến da dầu da mụn nhạy cảm","phù hợp da nhạy màu xanh, dùng được với da hỗn hợp đến da dầu",5 ml,,svr,3 năm kể từ ngày sản xuất,pháp,7811333024,210104545,no_type,no_skin,0.9691848906560636,0.05438879913839526,108000.0
Sữa rửa Mặt Con Bò Loyolan 120g,tinh chất làm trắng da từ sữa bò 10,"cho làn da trắng sáng mịn màng, bảo vệ da ngăn chặn những vết nám trên da, ngăn chặn mụn đầu đen và mụn cám, cung cấp chất dưỡng ẩm cho da, đem lại vẻ mịn màng cho da",,,,lyolan,,,14085589877,31738854,no_type,no_skin,1.0,0.0015885837372105547,16500.0
Gel rửa mặt bí đao Cocoon 140ml ngăn ngừa mụn thâm,"bí đao, rau má, tràm trà, betaine, các chất hoạt động bề mặt dịu nhẹ","giảm thiểu tình trạng đỏ, tăng cường khả năng miễn dịch cho da, phục hồi da hư tổn, làm sạch sâu bụi bẩn và dầu thừa, giảm sự hình thành mụn ẩn, giữ được độ ẩm mịn tự nhiên và không bị khô da khi sử dụng",,,,cocon,3 năm kể từ ngày sản xuất in trên chai,,7016425827,80473795,no_type,no_skin,0.9669811320754716,0.003080236941303177,138000.0
Sữa Rửa Mặt Dạng Gel Simple Kind To Skin Refreshing Facial Wash Gel,"sữa rửa mặt simple là sự hòa hợp hoàn hảo giữa các thành phần giúp nhẹ nhàng làm sạch da mà không làm mất đi độ ẩm tự nhiên của da, trả lại làn da mềm mại tươi mát. sản phẩm không chứa hương liệu phụ gia không cần thiết và đã được kiểm nghiệm da liễu phù hợp với mọi loại da kể cả da nhạy cảm. vitamin b5 và vitamin e không màu nhân tạo, hóa chất độc hại.","sữa rửa mặt simple cho bạn một làn da ẩm mềm mịn nhẹ dịu sạch sâu dưới lỗ chân lông ngay cả với da khô. sản phẩm cũng đồng thời cung cấp nước giữ ẩm giúp da luôn căng bóng tươi hồng. tạo bọt nhẹ nhàng cuốn đi lớp bụi bẩn bám sâu dưới bề mặt da, cặn trang điểm, tế bào chết. trả lại cho bạn một làn da tươi mát sạch khuẩn.",mọi loại da kể cả da nhạy cảm,150 ml,nan,simple,,anh,15560275660,64756349,no_type,Mọi loại da,0.9433962264150944,0.0011200861604738826,82000.0
Sữa Rửa Mặt Dove Tạo Bọt 40% Serum 130g,"chiết xuất từ nutrium moisture, tinh khiết galate và các chất chống oxy hóa khác","chống ô xy hóa, phục hồi da hư tổn, tẩy sạch chất nhờn và bụi bẩn bám trên da, tẩy tế bào chết, xóa mờ nếp nhăn tàn nhang mụn cám trên da, kiểm soát tốt vùng mụn và tránh lây lan, se khít lỗ chân lông, dưỡng ẩm hiệu quả, ngăn ngừa quá trình lão hóa và trẻ hóa làn da",,,,,,japan,6572512312,51381266,no_type,no_skin,0.9090909090909091,0.000263866451265482,41000.0
"[New 2019] Sữa Rửa Mặt Tro Núi Lửa GIẢM Đầu Đen, Bã Nhờn Innisfree Jeju Volcanic Pore Cleansing Foam 150ml",chiết xuất tro núi lửa,"hút bã nhờn và làm sạch lỗ chân lông, giảm mụn, se khít lỗ chân lông","dành cho da dầu, da hỗn hợp, da nhạy cảm",150 ml,,inisfre,,,7513238074,8516029,no_type,Mọi loại da,0.9707792207792207,0.0050619278406031235,145000.0
Kem rửa mặt ngăn ngừa mụn Acnes Creamy Wash 100g,"acid zinc, water, palmitic acid, peg 2, butylene glycol, myristic acid, lauric acid, potasium, olea europaea (olive) fruit oil, dea, potasium lauroyl, zinc extract, sodium acetate, ascorbyl, stearyl, lactic acid, lauryl, potasium chloride, ethanol, sodium, ci 728, ci 7492","rửa sạch chất nhờn dư, tế bào chết và bụi bẩn tận sâu lỗ chân lông, hỗ trợ quá trình tái tạo da, kiểm soát chất nhờn dư, kháng khuẩn mụn, giảm mụn, hạn chế sẹo thâm, giúp da mịn màng, ngăn ngừa hình thành mụn mới",,,,acnes,3 năm kể từ nsx,việt nam,2857314189,152872415,no_type,no_skin,0.9571428571428572,0.002504038772213247,49000.0
Sữa rửa mặt làm sạch dịu nhẹ Cetaphil Gentle Skin Cleanser 125ml-500ml,"purified alcohol, glycol, sodium lauryl sulfate, stearyl alcohol, methyl propyl butyl","làm sạch dịu nhẹ, giữ ẩm tự nhiên, bảo vệ da khỏi nhạy cảm, da khô, da căng, da kích ứng, da kém mịn màng",mọi loại da,"59 ml, 125 ml, 250 ml, 50 ml",,cetaphil,36 tháng,,15091336986,804248731,no_type,no_skin,0.9459459459459459,0.0006192784060312332,224000.0
Sữa Rửa Mặt Innisfree Green Tea Foam Cleanser 150ml,thành phần từ trà xanh chứa đến 16 loại acid amin có lợi cho da,"loại bỏ lớp bụi bẩn bã nhờn tế bào chết trên da, tăng cường khả năng kiểm soát dầu để giảm thiểu tình trạng bí tắt lỗ chân lông, giúp giảm mụn và ngăn ngừa mụn hiệu quả, dưỡng ẩm da nhẹ nhàng giữ da ẩm mượt sau khi làm sạch","phù hợp với mọi loại da kể cả da nhạy cảm, đặc biệt lý tưởng với da dầu và có mụn",,"có chất kem mềm mịn, rất dễ dàng tạo bọt khi apply lên da, nhẹ nhàng ôm ấp làn da bạn bằng những dưỡng chất có lợi từ trà xanh",inisfre,,,2275244655,27967779,no_type,no_skin,1.0,0.00045772751750134625,125000.0
[Mã COSACD6 giảm 10% đơn 400K] Sữa rửa mặt giúp làm sạch sâu cho da thường và da khô Cerave Hydrating Cleanser 88ML,ba thiết yếu và acid,làm sạch và giữ ẩm cho làn da mà không ảnh hưởng đến hàng rào bảo vệ da mặt và cơ thể,,,,cerave,,,20034567148,812449960,dạng sánh,Bình thường,0.9127906976744186,0.0037049003769520734,145000.0
Sữa rửa mặt Hazeline nghệ kiwi và mát cha lưu đỏ 50g,"tình chất nghệ vàng, vitamin a c e, các chất chống oxy hóa","làm sạch sẹo, kháng khuẩn, kiểm soát bã nhờn từ lỗ chân lông, ngăn ngừa mụn hiệu quả, nuôi dưỡng làn da sáng mịn tự nhiên",,,,hazeline,,,2285582470,82405820,dạng kem,no_skin,0.9096385542168675,0.0026494345718901455,27000.0
Sữa rửa mặt Nhật Perfect Whip,phức hợp tơ tằm thiên nhiên và gấp đôi acid,"tẩy trang kết hợp làm sạch, giúp da sáng khỏe, ngăn chặn các sắc tố melanin gây vết đốm tàn nhang, chống lại lão hóa trên da, bổ sung độ ẩm dưỡng chất có lợi cho da, đem lại làn da trắng sáng và mềm mại",,120 g,"sản phẩm có hình dạng chai nhỏ, thuận tiện trong việc mang đi du lịch hoặc sử dụng hàng ngày",shiseido,,nhật bản,9018242541,185522883,no_type,no_skin,0.9314641744548287,0.008077544426494346,29192.0
[Mã COSCN12 giảm 8%] Gel rửa mặt hoa hồng Cocoon làm sạch & cấp ẩm 140ml,sodium cocoyl disodium laureth betaine rosa flower water peg 120 methyl glucose cocoyl methyl sodium peg 7 olive oil peg 7 glyceryl cocoate rosa extract betaine butylene glycol peg 120 methyl glucose citric acid caramel,"làm sạch bụi bẩn trong lỗ chân lông, bổ sung độ ẩm, làm mềm và làm dịu da","phù hợp với mọi loại da, đặc biệt là với da khô và da mất nước",,gel trong suốt không màu,,3 năm kể từ nsx,việt nam,3980168595,175753395,no_type,Khô,0.9672219236969372,0.026925148088314487,195000.0
Minisize Sữa rửa mặt COSRX Low pH Good Morning Gel Cleanser 50ml,"chiết xuất từ dầu cây trà và các thành phần tự nhiên khác, bha từ tự nhiên","làm sạch da hiệu quả mà không hề khô căng, có độ ph từ 5.0-6.0",sử dụng được cho mọi loại da kể cả làn da nhạy cảm,50ml,,shamrock,,hàn quốc,5363788914,155098200,no_type,no_skin,0.9259259259259259,0.00041464728056004306,89000.0
"Sữa rửa mặt blue copper peptide LUCENBASE cấp ẩm, giảm viêm đỏ 120g","nước, sodium cocoyl, sodium methyl cocoyl taurine, sodium glycol, citric acid, disodium cocoyl acrylic acid ester, coper retinol difision, lên men lysate, sodium, sodium polymer liên kết ngang, sodium isomer, butylene glycol, glabra glabra chiết xuất rễ, chiết xuất tảo đỏ thủy phân, chiết xuất hoa oải hương pháp, chiết xuất lá củ cải brasica rapa, xanthan gum, cetearyl alcohol, betaine, sodium pca acid, sodium lactate, serine, proline, glycine, alanine, lysine hci, sodium citrate, sucrose, phenolic acetate, glyceryl glycol, rose turkican rosa tinh dầu hoa","cấp ẩm, chống lão hóa, giúp đàn hồi da, giảm viêm, cho làn da mụn",phù hợp với mọi loại da,120 g,,,3 năm kể từ ngày sản xuất,trung quốc,11445684593,523613281,no_type,Mọi loại da,0.9834254143646409,0.003031771674744211,137000.0
"Gel bí đao rửa mặt Cocoon (Winter melon cleanser), sữa rửa mặt dạng gel thuần chay giảm dầu & mụn BIGSIZE 310ml - HUNOXA","nâu vàng bí đao, rau má, tinh dầu tràm trà, vitamin b3, vitamin b5, betaine","giảm dầu thừa, giảm mụn, dưỡng ẩm, làm sạch lỗ chân lông, giữ ẩm cho da",,310 ml,chai nhựa,hunoxa,3 năm kể từ nsx,việt nam,21424422021,710688996,no_type,no_skin,0.9302325581395349,0.0007377490576198169,220500.0
Gel rửa mặt Anteka Green Pharmacy,"chiết xuất từ thiên nhiên, chiết xuất lô hội, dầu hạt lanh, chiết xuất nho, protein lúa mì, alantoin","làm sạch hàng ngày cho mặt và cổ, không bị khô và cảm giác căng, dưỡng da mềm mịn tươi mới, chống viêm, làm dịu da","da khô và nhạy cảm, mọi loại da",270ml,,anteka,,"công ty sao mai, hà nội",7155661222,313414847,dạng sánh,Mọi loại da,1.0,0.000683898761443188,70000.0
Sữa Rửa Mặt Hazeline Tuýp 50g/100g (Nghệ/Yến Mạch/Matcha),"thiên nhiên, nghệ, myristic acid, potassium acid","sạch da, trắng da, không gây khô da, giảm mụn, làm sáng da",,,,hazeline,,,11793868271,747976740,no_type,no_skin,0.9523809523809523,0.0006085083467959074,37500.0
Mousse rửa mặt bọt mịn Dove serum sạch sâu chai 160ml (Sữa rửa mặt dạng bọt Dove),"chiết xuất cây phỉ, chiết xuất trái cây, chiết xuất hoa cúc, ipmp","cấp ẩm, giúp kiềm dầu và giảm mụn, giúp làm sạch dịu nhẹ cho da nhạy cảm, giúp tạo môi trường vi sinh vật lành mạnh, tự tạo lớp bọt dày mịn giúp sạch sâu","da khô, da thường, da dầu, da hỗn hợp, da mụn, da nhạy cảm",chai 160 ml,màu sắc đa dạng,dove,,nhật bản,17085754312,38674078,no_type,no_skin,1.0,0.00027463651050080773,79000.0
Sữa Rửa Mặt Giảm Mụn dạng Gel Sebiaclear Gel Moussant 400ml,"lactic acid, phức hợp mat sr 0.5, ","giảm mụn, làm sạch da, cải thiện kết cấu da, tẩy tế bào chết, giảm dầu thừa, cân bằng độ ph, dịu nhẹ, lành tính và an toàn cho da nhạy cảm.",da mụn nhạy cảm,40ml,"dạng gel siêu nhẹ, chuyển sang dạng bọt mịn như kem",,,pháp,14990157764,319175938,no_type,"Da mụn trứng cá, Mọi loại da, Da hỗn hợp, Dầu",0.9930555555555556,0.0025740441572428647,227000.0
Sữa Rửa Mặt Tràm Trà Derladie Herbal Extract Care Deep Cleansing Foam 150ml Sạch Mịn Ngừa Giảm Mụn Hiệu Quả [NHẬP KHẨU],"chiết xuất tinh dầu tràm trà, 4 loại acid amin và 10 loại thảo mộc thiên nhiên","loại bỏ bụi bẩn, bã nhờn, dầu thừa, làm sạch sâu và se khít lỗ chân lông, ngăn ngừa tiếp tục mụn đầu đen, mụn trứng cá, hỗ trợ làm sáng da, làm mờ vết thâm sẹo do mụn","đặc biệt da mụn, da dầu",150 ml,tuýp,derladie,,hàn quốc,12736759576,232143567,dạng sánh,"Da mụn trứng cá, Lão hóa, Mọi loại da, Da hỗn hợp, Dầu",0.9706546275395034,0.005385029617662897,114500.0
Sữa rửa mặt CERAVE Foaming Facial Cleanser ( 236ml /473ml ),,"làm sạch da, ngừa mụn, đạt chuẩn vừa sạch da lại cực kì an toàn",da dầu và da nhạy cảm,35 ml,chai,cerave,2 năm,made in france,3884948123,78052603,dạng sánh,"Mọi loại da, Da hỗn hợp",0.9655172413793104,0.0042380183091007,305000.0
Thanh lý sữa rửa mặt Pond’s 40g đất sét,,khoáng sạch sâu và sáng da,,,,ponds,,,14464686673,30855346,dạng kem,Mọi loại da,0.8769230769230769,0.0018416801292407109,7500.0
Sữa rửa mặt Làm sạch sâu - Cấp nước - Dưỡng ẩm sâu Images Milk Hydrating Cleanser,chiết xuất từ sữa bò tươi,"làm sạch da, cấp nước và dưỡng ẩm sâu",,120ml,thiết kế mới với vòi lấy sữa rửa mặt tiện dụng,,,nội địa,7107340700,74150926,no_type,no_skin,0.9635627530364372,0.003392568659127625,28000.0
SIMPLE -  Sữa Rửa Mặt 150ml + Nước Tẩy Trang 200ml + Nước Hoa Hồng 200ml Cung Cấp Độ Ẩm Ngăn Ngừa Mụn Cho Làn Da Sáng.,"chiết xuất hoa cúc la mã, vitamin b3, vitamin c và nước cất 3 lần tinh khiết","tẩy trang sạch sâu, rửa mặt sạch thoáng, cấp ẩm, làm dịu và phục hồi da",phù hợp cho mọi loại da kể cả làn da nhạy cảm,,,simple,,anh quốc,12247304241,79332105,no_type,"Da mụn trứng cá, Mọi loại da, Da hỗn hợp, Bình thường",0.9,0.0009262250942380184,65000.0
Sữa rửa mặt và toàn thân cao cấp Gamma Adaphil Gentle Skin Cleanser 125ml,,"làm sạch và dưỡng da cao cấp, không chứa kiềm và hương liệu gây nhờn trứng cá, thích hợp cho nhiều loại da, đặc biệt là da mỏng manh, nhạy cảm của trẻ sơ sinh và trẻ nhỏ",,125 ml,,gama adaphil,3 năm từ nsx,việt nam,9174969865,258099521,no_type,no_skin,0.9820359281437125,0.0024932687129779214,69000.0
Gel sữa rửa mặt Compliment No Problem giảm mụn,"không cồn khô, acid bha, chiết xuất hoa cúc, tea tre oil","giảm mụn, phá hủy vi khuẩn gây viêm, ngăn ngừa mụn quay trở lại, loại bỏ bụi bẩn từ lỗ chân lông, cung cấp ẩm lâu dài","mọi loại da, đặc biệt da dầu mụn",,,no problem,,,10913773984,315064168,no_type,no_skin,0.959349593495935,0.0026386645126548194,85000.0
"[Hàng Auth] Bộ simple nước tẩy trang simple 200ml, sữa rửa mặt dành cho da nhạy cảm 150ml, nước hoa hồng simple 200ml","chứa vitamin b3, vitamin c, chiết xuất cây hazel, chiết xuất sản phẩm giữ ẩm","làm sạch da, giúp cung cấp dưỡng chất, cân bằng độ ẩm cho da, làm dịu da, giúp làm sáng da","phù hợp cho mọi loại da, kể cả làn da nhạy cảm","nước tẩy trang simple micelar water 20 ml, sữa rửa mặt dành cho da nhạy cảm 150 ml, nước hoa hồng simple 20 ml",,simple,,anh,20122431937,686687699,no_type,"Khô, Nhạy cảm",1.0,4.3080236941303174e-05,179500.0
Sữa Rửa Mặt floslex Pharma Antibacterial Face Cleansing Cho Da Dầu Mụn (MẪU MỚI),cải xong rễ ngưu bàng lá cây xô thơm cây vạn niên cỏ bồ hòn tảo gạc hươu cùng nhiều hoạt chất khác,tấn công vào sâu bên trong da tống khứ hoàn toàn bụi bẩn bã nhờn tế bào chết tạp chất kết dính trong lỗ chân lông làm thông thoáng lỗ chân lông để ngăn ngừa và tiêu diệt hoàn toàn các vi khuẩn bao gồm vi khuẩn gây mụn p acnes,da nhờn mụn,20 ml,dạng gel,floslek,,,13246621162,20895938,no_type,no_skin,0.9932885906040269,0.002358642972536349,149500.0
Sữa rửa mặt tầng sâu Đan thy,,"làm sạch sâu, kháng khuẩn, ngừa mụn, se khít lỗ chân lông, trẻ hóa da, kiềm dầu suốt 12 h",,,,lodas luxury,,,7378558316,46556666,dạng kem,"Mọi loại da, Da hỗn hợp, Khô, Dầu, Nhạy cảm",0.9618320610687023,0.004474959612277868,87220.0
